[{"id":"QUxMIEZPTERFUlMgKDEpL0IvMDAuQWx0IGZyYSBiaXNwZWJqZXJnIHNhbWxldC9NZW51cGxhbmVyL01lbnVwbGFuZXIsIGtvc3RwbGFuZXIgR0FNTEUvTWVudXBsYW5lciAyMDI0L1VnZSAyNSwyNiAyMDI0LmRvY3gvZ29vZ2xlX2RyaXZlX2RhdGE=","name":"Uge 25,26 2024","filename":"Uge 25,26 2024.docx","path":"/google_drive_data/ALL FOLDERS (1)/B/00.Alt fra bispebjerg samlet/Menuplaner/Menuplaner, kostplaner GAMLE/Menuplaner 2024/Uge 25,26 2024.docx","category":"ALL FOLDERS (1)","subCategory":"B","type":"docx","size":1566899,"modified":"2024-06-04T04:55:30.000Z"},{"id":"QUxMIEZPTERFUlMgKDEpL0IvMDAuQWx0IGZyYSBiaXNwZWJqZXJnIHNhbWxldC9NZW51cGxhbmVyL01lbnVwbGFuZXIsIGtvc3RwbGFuZXIgR0FNTEUvTWVudXBsYW5lciAyMDI0L1VnZSAyNSwyNiAyMDI0LnBkZi9nb29nbGVfZHJpdmVfZGF0YQ==","name":"Uge 25,26 2024","filename":"Uge 25,26 2024.pdf","path":"/google_drive_data/ALL FOLDERS (1)/B/00.Alt fra bispebjerg samlet/Menuplaner/Menuplaner, kostplaner GAMLE/Menuplaner 2024/Uge 25,26 2024.pdf","category":"ALL FOLDERS (1)","subCategory":"B","type":"pdf","size":3377985,"modified":"2024-06-04T04:56:00.000Z"},{"id":"QUxMIEZPTERFUlMgKDEpL0IvMDAuQWx0IGZyYSBiaXNwZWJqZXJnIHNhbWxldC9NZW51cGxhbmVyL01lbnVwbGFuZXIsIGtvc3RwbGFuZXIgR0FNTEUvTWVudXBsYW5lciAyMDI0L1VnZSAyNywyOCAyMDI0LmRvY3gvZ29vZ2xlX2RyaXZlX2RhdGE=","name":"Uge 27,28 2024","filename":"Uge 27,28 2024.docx","path":"/google_drive_data/ALL FOLDERS (1)/B/00.Alt fra bispebjerg samlet/Menuplaner/Menuplaner, kostplaner GAMLE/Menuplaner 2024/Uge 27,28 2024.docx","category":"ALL FOLDERS (1)","subCategory":"B","type":"docx","size":1565102,"modified":"2024-06-07T09:38:12.000Z"},{"id":"QUxMIEZPTERFUlMgKDEpL0IvMDAuQWx0IGZyYSBiaXNwZWJqZXJnIHNhbWxldC9NZW51cGxhbmVyL01lbnVwbGFuZXIsIGtvc3RwbGFuZXIgR0FNTEUvTWVudXBsYW5lciAyMDI0L1VnZSAyNywyOCAyMDI0LnBkZi9nb29nbGVfZHJpdmVfZGF0YQ==","name":"Uge 27,28 2024","filename":"Uge 27,28 2024.pdf","path":"/google_drive_data/ALL FOLDERS (1)/B/00.Alt fra bispebjerg samlet/Menuplaner/Menuplaner, kostplaner GAMLE/Menuplaner 2024/Uge 27,28 2024.pdf","category":"ALL FOLDERS (1)","subCategory":"B","type":"pdf","size":1496498,"modified":"2024-06-17T08:29:34.000Z"},{"id":"QUxMIEZPTERFUlMgKDEpL0IvMDAuQWx0IGZyYSBiaXNwZWJqZXJnIHNhbWxldC9NZW51cGxhbmVyL01lbnVwbGFuZXIsIGtvc3RwbGFuZXIgR0FNTEUvTWVudXBsYW5lciAyMDI0L1VnZSAyOSwzMCAyMDI0LmRvY3gvZ29vZ2xlX2RyaXZlX2RhdGE=","name":"Uge 29,30 2024","filename":"Uge 29,30 2024.docx","path":"/google_drive_data/ALL FOLDERS (1)/B/00.Alt fra bispebjerg samlet/Menuplaner/Menuplaner, kostplaner GAMLE/Menuplaner 2024/Uge 29,30 2024.docx","category":"ALL FOLDERS (1)","subCategory":"B","type":"docx","size":1567794,"modified":"2024-07-04T09:34:53.000Z"},{"id":"QUxMIEZPTERFUlMgKDEpL0IvMDAuQWx0IGZyYSBiaXNwZWJqZXJnIHNhbWxldC9NZW51cGxhbmVyL01lbnVwbGFuZXIsIGtvc3RwbGFuZXIgR0FNTEUvTWVudXBsYW5lciAyMDI0L1VnZSAyOSwzMCAyMDI0LnBkZi9nb29nbGVfZHJpdmVfZGF0YQ==","name":"Uge 29,30 2024","filename":"Uge 29,30 2024.pdf","path":"/google_drive_data/ALL FOLDERS (1)/B/00.Alt fra bispebjerg samlet/Menuplaner/Menuplaner, kostplaner GAMLE/Menuplaner 2024/Uge 29,30 2024.pdf","category":"ALL FOLDERS (1)","subCategory":"B","type":"pdf","size":1496820,"modified":"2024-07-04T09:35:22.000Z"},{"id":"QUxMIEZPTERFUlMgKDEpL0IvMDAuQWx0IGZyYSBiaXNwZWJqZXJnIHNhbWxldC9NZW51cGxhbmVyL01lbnVwbGFuZXIsIGtvc3RwbGFuZXIgR0FNTEUvTWVudXBsYW5lciAyMDI0L1VnZSAzLDQgMjAyNC5kb2N4L2dvb2dsZV9kcml2ZV9kYXRh","name":"Uge 3,4 2024","filename":"Uge 3,4 2024.docx","path":"/google_drive_data/ALL FOLDERS (1)/B/00.Alt fra bispebjerg samlet/Menuplaner/Menuplaner, kostplaner GAMLE/Menuplaner 2024/Uge 3,4 2024.docx","category":"ALL FOLDERS (1)","subCategory":"B","type":"docx","size":1563400,"modified":"2023-12-18T06:06:22.000Z"},{"id":"QUxMIEZPTERFUlMgKDEpL0IvMDAuQWx0IGZyYSBiaXNwZWJqZXJnIHNhbWxldC9NZW51cGxhbmVyL01lbnVwbGFuZXIsIGtvc3RwbGFuZXIgR0FNTEUvTWVudXBsYW5lciAyMDI0L1VnZSAzLDQgMjAyNC5wZGYvZ29vZ2xlX2RyaXZlX2RhdGE=","name":"Uge 3,4 2024","filename":"Uge 3,4 2024.pdf","path":"/google_drive_data/ALL FOLDERS (1)/B/00.Alt fra bispebjerg samlet/Menuplaner/Menuplaner, kostplaner GAMLE/Menuplaner 2024/Uge 3,4 2024.pdf","category":"ALL FOLDERS (1)","subCategory":"B","type":"pdf","size":1495757,"modified":"2023-12-18T06:06:30.000Z"},{"id":"QUxMIEZPTERFUlMgKDEpL0IvMDAuQWx0IGZyYSBiaXNwZWJqZXJnIHNhbWxldC9NZW51cGxhbmVyL01lbnVwbGFuZXIsIGtvc3RwbGFuZXIgR0FNTEUvTWVudXBsYW5lciAyMDI0L1VnZSAzMSwzMiAyMDI0LmRvY3gvZ29vZ2xlX2RyaXZlX2RhdGE=","name":"Uge 31,32 2024","filename":"Uge 31,32 2024.docx","path":"/google_drive_data/ALL FOLDERS (1)/B/00.Alt fra bispebjerg samlet/Menuplaner/Menuplaner, kostplaner GAMLE/Menuplaner 2024/Uge 31,32 2024.docx","category":"ALL FOLDERS (1)","subCategory":"B","type":"docx","size":1566481,"modified":"2024-07-15T09:06:30.000Z"},{"id":"QUxMIEZPTERFUlMgKDEpL0IvMDAuQWx0IGZyYSBiaXNwZWJqZXJnIHNhbWxldC9NZW51cGxhbmVyL01lbnVwbGFuZXIsIGtvc3RwbGFuZXIgR0FNTEUvTWVudXBsYW5lciAyMDI0L1VnZSAzMSwzMiAyMDI0LnBkZi9nb29nbGVfZHJpdmVfZGF0YQ==","name":"Uge 31,32 2024","filename":"Uge 31,32 2024.pdf","path":"/google_drive_data/ALL FOLDERS (1)/B/00.Alt fra bispebjerg samlet/Menuplaner/Menuplaner, kostplaner GAMLE/Menuplaner 2024/Uge 31,32 2024.pdf","category":"ALL FOLDERS (1)","subCategory":"B","type":"pdf","size":1496560,"modified":"2024-07-15T09:20:02.000Z"},{"id":"QUxMIEZPTERFUlMgKDEpL0IvMDAuQWx0IGZyYSBiaXNwZWJqZXJnIHNhbWxldC9NZW51cGxhbmVyL01lbnVwbGFuZXIsIGtvc3RwbGFuZXIgR0FNTEUvTWVudXBsYW5lciAyMDI0L1VnZSAzMywzNCAyMDI0LmRvY3gvZ29vZ2xlX2RyaXZlX2RhdGE=","name":"Uge 33,34 2024","filename":"Uge 33,34 2024.docx","path":"/google_drive_data/ALL FOLDERS (1)/B/00.Alt fra bispebjerg samlet/Menuplaner/Menuplaner, kostplaner GAMLE/Menuplaner 2024/Uge 33,34 2024.docx","category":"ALL FOLDERS (1)","subCategory":"B","type":"docx","size":1563511,"modified":"2024-07-15T10:20:19.000Z"},{"id":"QUxMIEZPTERFUlMgKDEpL0IvMDAuQWx0IGZyYSBiaXNwZWJqZXJnIHNhbWxldC9NZW51cGxhbmVyL01lbnVwbGFuZXIsIGtvc3RwbGFuZXIgR0FNTEUvTWVudXBsYW5lciAyMDI0L1VnZSAzMywzNCAyMDI0LnBkZi9nb29nbGVfZHJpdmVfZGF0YQ==","name":"Uge 33,34 2024","filename":"Uge 33,34 2024.pdf","path":"/google_drive_data/ALL FOLDERS (1)/B/00.Alt fra bispebjerg samlet/Menuplaner/Menuplaner, kostplaner GAMLE/Menuplaner 2024/Uge 33,34 2024.pdf","category":"ALL FOLDERS (1)","subCategory":"B","type":"pdf","size":1496289,"modified":"2024-07-29T07:24:55.000Z"},{"id":"QUxMIEZPTERFUlMgKDEpL0IvMDAuQWx0IGZyYSBiaXNwZWJqZXJnIHNhbWxldC9NZW51cGxhbmVyL01lbnVwbGFuZXIsIGtvc3RwbGFuZXIgR0FNTEUvTWVudXBsYW5lciAyMDI0L1VnZSAzNSwzNiAyMDI0LmRvY3gvZ29vZ2xlX2RyaXZlX2RhdGE=","name":"Uge 35,36 2024","filename":"Uge 35,36 2024.docx","path":"/google_drive_data/ALL FOLDERS (1)/B/00.Alt fra bispebjerg samlet/Menuplaner/Menuplaner, kostplaner GAMLE/Menuplaner 2024/Uge 35,36 2024.docx","category":"ALL FOLDERS (1)","subCategory":"B","type":"docx","size":1566552,"modified":"2024-07-15T10:21:07.000Z"},{"id":"QUxMIEZPTERFUlMgKDEpL0IvMDAuQWx0IGZyYSBiaXNwZWJqZXJnIHNhbWxldC9NZW51cGxhbmVyL01lbnVwbGFuZXIsIGtvc3RwbGFuZXIgR0FNTEUvTWVudXBsYW5lciAyMDI0L1VnZSAzNSwzNiAyMDI0LnBkZi9nb29nbGVfZHJpdmVfZGF0YQ==","name":"Uge 35,36 2024","filename":"Uge 35,36 2024.pdf","path":"/google_drive_data/ALL FOLDERS (1)/B/00.Alt fra bispebjerg samlet/Menuplaner/Menuplaner, kostplaner GAMLE/Menuplaner 2024/Uge 35,36 2024.pdf","category":"ALL FOLDERS (1)","subCategory":"B","type":"pdf","size":1496272,"modified":"2024-07-29T07:25:30.000Z"},{"id":"QUxMIEZPTERFUlMgKDEpL0IvMDAuQWx0IGZyYSBiaXNwZWJqZXJnIHNhbWxldC9NZW51cGxhbmVyL01lbnVwbGFuZXIsIGtvc3RwbGFuZXIgR0FNTEUvTWVudXBsYW5lciAyMDI0L1VnZSAzNywzOCAyMDI0LmRvY3gvZ29vZ2xlX2RyaXZlX2RhdGE=","name":"Uge 37,38 2024","filename":"Uge 37,38 2024.docx","path":"/google_drive_data/ALL FOLDERS (1)/B/00.Alt fra bispebjerg samlet/Menuplaner/Menuplaner, kostplaner GAMLE/Menuplaner 2024/Uge 37,38 2024.docx","category":"ALL FOLDERS (1)","subCategory":"B","type":"docx","size":1564359,"modified":"2024-07-15T10:21:35.000Z"},{"id":"QUxMIEZPTERFUlMgKDEpL0IvMDAuQWx0IGZyYSBiaXNwZWJqZXJnIHNhbWxldC9NZW51cGxhbmVyL01lbnVwbGFuZXIsIGtvc3RwbGFuZXIgR0FNTEUvTWVudXBsYW5lciAyMDI0L1VnZSAzNywzOCAyMDI0LnBkZi9nb29nbGVfZHJpdmVfZGF0YQ==","name":"Uge 37,38 2024","filename":"Uge 37,38 2024.pdf","path":"/google_drive_data/ALL FOLDERS (1)/B/00.Alt fra bispebjerg samlet/Menuplaner/Menuplaner, kostplaner GAMLE/Menuplaner 2024/Uge 37,38 2024.pdf","category":"ALL FOLDERS (1)","subCategory":"B","type":"pdf","size":1496363,"modified":"2024-07-29T07:26:17.000Z"},{"id":"QUxMIEZPTERFUlMgKDEpL0IvMDAuQWx0IGZyYSBiaXNwZWJqZXJnIHNhbWxldC9NZW51cGxhbmVyL01lbnVwbGFuZXIsIGtvc3RwbGFuZXIgR0FNTEUvTWVudXBsYW5lciAyMDI0L1VnZSAzOSw0MCAyMDI0LmRvY3gvZ29vZ2xlX2RyaXZlX2RhdGE=","name":"Uge 39,40 2024","filename":"Uge 39,40 2024.docx","path":"/google_drive_data/ALL FOLDERS (1)/B/00.Alt fra bispebjerg samlet/Menuplaner/Menuplaner, kostplaner GAMLE/Menuplaner 2024/Uge 39,40 2024.docx","category":"ALL FOLDERS (1)","subCategory":"B","type":"docx","size":1564099,"modified":"2024-09-11T04:52:53.000Z"},{"id":"QUxMIEZPTERFUlMgKDEpL0IvMDAuQWx0IGZyYSBiaXNwZWJqZXJnIHNhbWxldC9NZW51cGxhbmVyL01lbnVwbGFuZXIsIGtvc3RwbGFuZXIgR0FNTEUvTWVudXBsYW5lciAyMDI0L1VnZSAzOSw0MCAyMDI0LnBkZi9nb29nbGVfZHJpdmVfZGF0YQ==","name":"Uge 39,40 2024","filename":"Uge 39,40 2024.pdf","path":"/google_drive_data/ALL FOLDERS (1)/B/00.Alt fra bispebjerg samlet/Menuplaner/Menuplaner, kostplaner GAMLE/Menuplaner 2024/Uge 39,40 2024.pdf","category":"ALL FOLDERS (1)","subCategory":"B","type":"pdf","size":2305437,"modified":"2024-09-11T05:12:50.000Z"},{"id":"QUxMIEZPTERFUlMgKDEpL0IvMDAuQWx0IGZyYSBiaXNwZWJqZXJnIHNhbWxldC9NZW51cGxhbmVyL01lbnVwbGFuZXIsIGtvc3RwbGFuZXIgR0FNTEUvTWVudXBsYW5lciAyMDI0L1VnZSA0MSw0MiAyMDI0LmRvY3gvZ29vZ2xlX2RyaXZlX2RhdGE=","name":"Uge 41,42 2024","filename":"Uge 41,42 2024.docx","path":"/google_drive_data/ALL FOLDERS (1)/B/00.Alt fra bispebjerg samlet/Menuplaner/Menuplaner, kostplaner GAMLE/Menuplaner 2024/Uge 41,42 2024.docx","category":"ALL FOLDERS (1)","subCategory":"B","type":"docx","size":1567342,"modified":"2024-09-24T11:44:19.000Z"},{"id":"QUxMIEZPTERFUlMgKDEpL0IvMDAuQWx0IGZyYSBiaXNwZWJqZXJnIHNhbWxldC9NZW51cGxhbmVyL01lbnVwbGFuZXIsIGtvc3RwbGFuZXIgR0FNTEUvTWVudXBsYW5lciAyMDI0L1VnZSA0MSw0MiAyMDI0LnBkZi9nb29nbGVfZHJpdmVfZGF0YQ==","name":"Uge 41,42 2024","filename":"Uge 41,42 2024.pdf","path":"/google_drive_data/ALL FOLDERS (1)/B/00.Alt fra bispebjerg samlet/Menuplaner/Menuplaner, kostplaner GAMLE/Menuplaner 2024/Uge 41,42 2024.pdf","category":"ALL FOLDERS (1)","subCategory":"B","type":"pdf","size":2305574,"modified":"2024-09-24T11:44:52.000Z"},{"id":"QUxMIEZPTERFUlMgKDEpL0IvMDAuQWx0IGZyYSBiaXNwZWJqZXJnIHNhbWxldC9NZW51cGxhbmVyL01lbnVwbGFuZXIsIGtvc3RwbGFuZXIgR0FNTEUvTWVudXBsYW5lciAyMDI0L1VnZSA0Myw0NCAyMDI0LmRvY3gvZ29vZ2xlX2RyaXZlX2RhdGE=","name":"Uge 43,44 2024","filename":"Uge 43,44 2024.docx","path":"/google_drive_data/ALL FOLDERS (1)/B/00.Alt fra bispebjerg samlet/Menuplaner/Menuplaner, kostplaner GAMLE/Menuplaner 2024/Uge 43,44 2024.docx","category":"ALL FOLDERS (1)","subCategory":"B","type":"docx","size":1567319,"modified":"2024-10-07T05:33:51.000Z"},{"id":"QUxMIEZPTERFUlMgKDEpL0IvMDAuQWx0IGZyYSBiaXNwZWJqZXJnIHNhbWxldC9NZW51cGxhbmVyL01lbnVwbGFuZXIsIGtvc3RwbGFuZXIgR0FNTEUvTWVudXBsYW5lciAyMDI0L1VnZSA0Myw0NCAyMDI0LnBkZi9nb29nbGVfZHJpdmVfZGF0YQ==","name":"Uge 43,44 2024","filename":"Uge 43,44 2024.pdf","path":"/google_drive_data/ALL FOLDERS (1)/B/00.Alt fra bispebjerg samlet/Menuplaner/Menuplaner, kostplaner GAMLE/Menuplaner 2024/Uge 43,44 2024.pdf","category":"ALL FOLDERS (1)","subCategory":"B","type":"pdf","size":1308945,"modified":"2024-10-07T05:35:48.000Z"},{"id":"QUxMIEZPTERFUlMgKDEpL0IvMDAuQWx0IGZyYSBiaXNwZWJqZXJnIHNhbWxldC9NZW51cGxhbmVyL01lbnVwbGFuZXIsIGtvc3RwbGFuZXIgR0FNTEUvTWVudXBsYW5lciAyMDI0L1VnZSA0NSw0NiAyMDI0LmRvY3gvZ29vZ2xlX2RyaXZlX2RhdGE=","name":"Uge 45,46 2024","filename":"Uge 45,46 2024.docx","path":"/google_drive_data/ALL FOLDERS (1)/B/00.Alt fra bispebjerg samlet/Menuplaner/Menuplaner, kostplaner GAMLE/Menuplaner 2024/Uge 45,46 2024.docx","category":"ALL FOLDERS (1)","subCategory":"B","type":"docx","size":1567701,"modified":"2024-11-04T06:56:56.000Z"},{"id":"QUxMIEZPTERFUlMgKDEpL0IvMDAuQWx0IGZyYSBiaXNwZWJqZXJnIHNhbWxldC9NZW51cGxhbmVyL01lbnVwbGFuZXIsIGtvc3RwbGFuZXIgR0FNTEUvTWVudXBsYW5lciAyMDI0L1VnZSA0NSw0NiAyMDI0LnBkZi9nb29nbGVfZHJpdmVfZGF0YQ==","name":"Uge 45,46 2024","filename":"Uge 45,46 2024.pdf","path":"/google_drive_data/ALL FOLDERS (1)/B/00.Alt fra bispebjerg samlet/Menuplaner/Menuplaner, kostplaner GAMLE/Menuplaner 2024/Uge 45,46 2024.pdf","category":"ALL FOLDERS (1)","subCategory":"B","type":"pdf","size":9091928,"modified":"2024-11-04T06:57:12.000Z"},{"id":"QUxMIEZPTERFUlMgKDEpL0IvMDAuQWx0IGZyYSBiaXNwZWJqZXJnIHNhbWxldC9NZW51cGxhbmVyL01lbnVwbGFuZXIsIGtvc3RwbGFuZXIgR0FNTEUvTWVudXBsYW5lciAyMDI0L1VnZSA0Nyw0OCAyMDI0LmRvY3gvZ29vZ2xlX2RyaXZlX2RhdGE=","name":"Uge 47,48 2024","filename":"Uge 47,48 2024.docx","path":"/google_drive_data/ALL FOLDERS (1)/B/00.Alt fra bispebjerg samlet/Menuplaner/Menuplaner, kostplaner GAMLE/Menuplaner 2024/Uge 47,48 2024.docx","category":"ALL FOLDERS (1)","subCategory":"B","type":"docx","size":1566699,"modified":"2024-11-04T07:38:05.000Z"},{"id":"QUxMIEZPTERFUlMgKDEpL0IvMDAuQWx0IGZyYSBiaXNwZWJqZXJnIHNhbWxldC9NZW51cGxhbmVyL01lbnVwbGFuZXIsIGtvc3RwbGFuZXIgR0FNTEUvTWVudXBsYW5lciAyMDI0L1VnZSA0Nyw0OCAyMDI0LnBkZi9nb29nbGVfZHJpdmVfZGF0YQ==","name":"Uge 47,48 2024","filename":"Uge 47,48 2024.pdf","path":"/google_drive_data/ALL FOLDERS (1)/B/00.Alt fra bispebjerg samlet/Menuplaner/Menuplaner, kostplaner GAMLE/Menuplaner 2024/Uge 47,48 2024.pdf","category":"ALL FOLDERS (1)","subCategory":"B","type":"pdf","size":10088499,"modified":"2024-11-04T09:10:31.000Z"},{"id":"QUxMIEZPTERFUlMgKDEpL0IvMDAuQWx0IGZyYSBiaXNwZWJqZXJnIHNhbWxldC9NZW51cGxhbmVyL01lbnVwbGFuZXIsIGtvc3RwbGFuZXIgR0FNTEUvTWVudXBsYW5lciAyMDI0L1VnZSA0OSw1MCAyMDI0LmRvY3gvZ29vZ2xlX2RyaXZlX2RhdGE=","name":"Uge 49,50 2024","filename":"Uge 49,50 2024.docx","path":"/google_drive_data/ALL FOLDERS (1)/B/00.Alt fra bispebjerg samlet/Menuplaner/Menuplaner, kostplaner GAMLE/Menuplaner 2024/Uge 49,50 2024.docx","category":"ALL FOLDERS (1)","subCategory":"B","type":"docx","size":1566818,"modified":"2024-11-20T11:45:47.000Z"},{"id":"QUxMIEZPTERFUlMgKDEpL0IvMDAuQWx0IGZyYSBiaXNwZWJqZXJnIHNhbWxldC9NZW51cGxhbmVyL01lbnVwbGFuZXIsIGtvc3RwbGFuZXIgR0FNTEUvTWVudXBsYW5lciAyMDI0L1VnZSA0OSw1MCAyMDI0LnBkZi9nb29nbGVfZHJpdmVfZGF0YQ==","name":"Uge 49,50 2024","filename":"Uge 49,50 2024.pdf","path":"/google_drive_data/ALL FOLDERS (1)/B/00.Alt fra bispebjerg samlet/Menuplaner/Menuplaner, kostplaner GAMLE/Menuplaner 2024/Uge 49,50 2024.pdf","category":"ALL FOLDERS (1)","subCategory":"B","type":"pdf","size":10088578,"modified":"2024-11-20T11:46:06.000Z"},{"id":"QUxMIEZPTERFUlMgKDEpL0IvMDAuQWx0IGZyYSBiaXNwZWJqZXJnIHNhbWxldC9NZW51cGxhbmVyL01lbnVwbGFuZXIsIGtvc3RwbGFuZXIgR0FNTEUvTWVudXBsYW5lciAyMDI0L1VnZSA1LDYgMjAyNC5kb2N4L2dvb2dsZV9kcml2ZV9kYXRh","name":"Uge 5,6 2024","filename":"Uge 5,6 2024.docx","path":"/google_drive_data/ALL FOLDERS (1)/B/00.Alt fra bispebjerg samlet/Menuplaner/Menuplaner, kostplaner GAMLE/Menuplaner 2024/Uge 5,6 2024.docx","category":"ALL FOLDERS (1)","subCategory":"B","type":"docx","size":1565775,"modified":"2024-02-02T07:36:03.000Z"},{"id":"QUxMIEZPTERFUlMgKDEpL0IvMDAuQWx0IGZyYSBiaXNwZWJqZXJnIHNhbWxldC9NZW51cGxhbmVyL01lbnVwbGFuZXIsIGtvc3RwbGFuZXIgR0FNTEUvTWVudXBsYW5lciAyMDI0L1VnZSA1LDYgMjAyNC5wZGYvZ29vZ2xlX2RyaXZlX2RhdGE=","name":"Uge 5,6 2024","filename":"Uge 5,6 2024.pdf","path":"/google_drive_data/ALL FOLDERS (1)/B/00.Alt fra bispebjerg samlet/Menuplaner/Menuplaner, kostplaner GAMLE/Menuplaner 2024/Uge 5,6 2024.pdf","category":"ALL FOLDERS (1)","subCategory":"B","type":"pdf","size":1495017,"modified":"2024-02-02T07:38:07.000Z"},{"id":"QUxMIEZPTERFUlMgKDEpL0IvMDAuQWx0IGZyYSBiaXNwZWJqZXJnIHNhbWxldC9NZW51cGxhbmVyL01lbnVwbGFuZXIsIGtvc3RwbGFuZXIgR0FNTEUvTWVudXBsYW5lciAyMDI0L1VnZSA1MSw1MiAyMDI0LmRvY3gvZ29vZ2xlX2RyaXZlX2RhdGE=","name":"Uge 51,52 2024","filename":"Uge 51,52 2024.docx","path":"/google_drive_data/ALL FOLDERS (1)/B/00.Alt fra bispebjerg samlet/Menuplaner/Menuplaner, kostplaner GAMLE/Menuplaner 2024/Uge 51,52 2024.docx","category":"ALL FOLDERS (1)","subCategory":"B","type":"docx","size":1568723,"modified":"2024-12-04T07:36:39.000Z"},{"id":"QUxMIEZPTERFUlMgKDEpL0IvMDAuQWx0IGZyYSBiaXNwZWJqZXJnIHNhbWxldC9NZW51cGxhbmVyL01lbnVwbGFuZXIsIGtvc3RwbGFuZXIgR0FNTEUvTWVudXBsYW5lciAyMDI0L1VnZSA1MSw1MiAyMDI0LnBkZi9nb29nbGVfZHJpdmVfZGF0YQ==","name":"Uge 51,52 2024","filename":"Uge 51,52 2024.pdf","path":"/google_drive_data/ALL FOLDERS (1)/B/00.Alt fra bispebjerg samlet/Menuplaner/Menuplaner, kostplaner GAMLE/Menuplaner 2024/Uge 51,52 2024.pdf","category":"ALL FOLDERS (1)","subCategory":"B","type":"pdf","size":2305995,"modified":"2024-12-04T07:42:25.000Z"},{"id":"QUxMIEZPTERFUlMgKDEpL0IvMDAuQWx0IGZyYSBiaXNwZWJqZXJnIHNhbWxldC9NZW51cGxhbmVyL01lbnVwbGFuZXIsIGtvc3RwbGFuZXIgR0FNTEUvTWVudXBsYW5lciAyMDI0L1VnZSA3LDggMjAyNC5kb2N4L2dvb2dsZV9kcml2ZV9kYXRh","name":"Uge 7,8 2024","filename":"Uge 7,8 2024.docx","path":"/google_drive_data/ALL FOLDERS (1)/B/00.Alt fra bispebjerg samlet/Menuplaner/Menuplaner, kostplaner GAMLE/Menuplaner 2024/Uge 7,8 2024.docx","category":"ALL FOLDERS (1)","subCategory":"B","type":"docx","size":1563043,"modified":"2024-02-02T07:37:26.000Z"},{"id":"QUxMIEZPTERFUlMgKDEpL0IvMDAuQWx0IGZyYSBiaXNwZWJqZXJnIHNhbWxldC9NZW51cGxhbmVyL01lbnVwbGFuZXIsIGtvc3RwbGFuZXIgR0FNTEUvTWVudXBsYW5lciAyMDI0L1VnZSA3LDggMjAyNC5wZGYvZ29vZ2xlX2RyaXZlX2RhdGE=","name":"Uge 7,8 2024","filename":"Uge 7,8 2024.pdf","path":"/google_drive_data/ALL FOLDERS (1)/B/00.Alt fra bispebjerg samlet/Menuplaner/Menuplaner, kostplaner GAMLE/Menuplaner 2024/Uge 7,8 2024.pdf","category":"ALL FOLDERS (1)","subCategory":"B","type":"pdf","size":1495954,"modified":"2024-02-02T07:38:50.000Z"},{"id":"QUxMIEZPTERFUlMgKDEpL0IvMDAuQWx0IGZyYSBiaXNwZWJqZXJnIHNhbWxldC9NZW51cGxhbmVyL01lbnVwbGFuZXIsIGtvc3RwbGFuZXIgR0FNTEUvTWVudXBsYW5lciAyMDI0L1VnZSA5LDEwIDIwMjQuZG9jeC9nb29nbGVfZHJpdmVfZGF0YQ==","name":"Uge 9,10 2024","filename":"Uge 9,10 2024.docx","path":"/google_drive_data/ALL FOLDERS (1)/B/00.Alt fra bispebjerg samlet/Menuplaner/Menuplaner, kostplaner GAMLE/Menuplaner 2024/Uge 9,10 2024.docx","category":"ALL FOLDERS (1)","subCategory":"B","type":"docx","size":1564667,"modified":"2024-02-12T10:30:00.000Z"},{"id":"QUxMIEZPTERFUlMgKDEpL0IvMDAuQWx0IGZyYSBiaXNwZWJqZXJnIHNhbWxldC9NZW51cGxhbmVyL01lbnVwbGFuZXIsIGtvc3RwbGFuZXIgR0FNTEUvTWVudXBsYW5lciAyMDI0L1VnZSA5LDEwIDIwMjQucGRmL2dvb2dsZV9kcml2ZV9kYXRh","name":"Uge 9,10 2024","filename":"Uge 9,10 2024.pdf","path":"/google_drive_data/ALL FOLDERS (1)/B/00.Alt fra bispebjerg samlet/Menuplaner/Menuplaner, kostplaner GAMLE/Menuplaner 2024/Uge 9,10 2024.pdf","category":"ALL FOLDERS (1)","subCategory":"B","type":"pdf","size":1495821,"modified":"2024-02-12T11:48:41.000Z"},{"id":"QUxMIEZPTERFUlMgKDEpL0IvMDAuQWx0IGZyYSBiaXNwZWJqZXJnIHNhbWxldC9NZW51cGxhbmVyL05ZVCBNRU5VS09SVC5wZGYvZ29vZ2xlX2RyaXZlX2RhdGE=","name":"NYT MENUKORT","filename":"NYT MENUKORT.pdf","path":"/google_drive_data/ALL FOLDERS (1)/B/00.Alt fra bispebjerg samlet/Menuplaner/NYT MENUKORT.pdf","category":"ALL FOLDERS (1)","subCategory":"B","type":"pdf","size":213009,"modified":"2019-09-24T07:51:55.000Z"},{"id":"QUxMIEZPTERFUlMgKDEpL0IvMDAuQWx0IGZyYSBiaXNwZWJqZXJnIHNhbWxldC9NZW51cGxhbmVyL055IG1lbnVwbGFuLCBza2FiZWxvbmVyL01lbnVrb3J0X3NrYWJlbG9uLmRvYy9nb29nbGVfZHJpdmVfZGF0YQ==","name":"Menukort_skabelon","filename":"Menukort_skabelon.doc","path":"/google_drive_data/ALL FOLDERS (1)/B/00.Alt fra bispebjerg samlet/Menuplaner/Ny menuplan, skabeloner/Menukort_skabelon.doc","category":"ALL FOLDERS (1)","subCategory":"B","type":"doc","size":49664,"modified":"2015-09-30T14:33:04.000Z"},{"id":"QUxMIEZPTERFUlMgKDEpL0IvMDAuQWx0IGZyYSBiaXNwZWJqZXJnIHNhbWxldC9NZW51cGxhbmVyL055IG1lbnVwbGFuLCBza2FiZWxvbmVyL055IG1lbnVwbGFuIDIwMjAgMS5NYW5kYWcgdWdlIDEuZG9jeC9nb29nbGVfZHJpdmVfZGF0YQ==","name":"Ny menuplan 2020 1.Mandag uge 1","filename":"Ny menuplan 2020 1.Mandag uge 1.docx","path":"/google_drive_data/ALL FOLDERS (1)/B/00.Alt fra bispebjerg samlet/Menuplaner/Ny menuplan, skabeloner/Ny menuplan 2020 1.Mandag uge 1.docx","category":"ALL FOLDERS (1)","subCategory":"B","type":"docx","size":1520985,"modified":"2021-06-07T09:14:36.000Z"},{"id":"QUxMIEZPTERFUlMgKDEpL0IvMDAuQWx0IGZyYSBiaXNwZWJqZXJnIHNhbWxldC9NZW51cGxhbmVyL055IG1lbnVwbGFuLCBza2FiZWxvbmVyL055IG1lbnVwbGFuIDIwMjAgMTAuT25zZGFnIHVnZSAyLmRvY3gvZ29vZ2xlX2RyaXZlX2RhdGE=","name":"Ny menuplan 2020 10.Onsdag uge 2","filename":"Ny menuplan 2020 10.Onsdag uge 2.docx","path":"/google_drive_data/ALL FOLDERS (1)/B/00.Alt fra bispebjerg samlet/Menuplaner/Ny menuplan, skabeloner/Ny menuplan 2020 10.Onsdag uge 2.docx","category":"ALL FOLDERS (1)","subCategory":"B","type":"docx","size":1520615,"modified":"2020-06-05T05:40:11.000Z"},{"id":"QUxMIEZPTERFUlMgKDEpL0IvMDAuQWx0IGZyYSBiaXNwZWJqZXJnIHNhbWxldC9NZW51cGxhbmVyL055IG1lbnVwbGFuLCBza2FiZWxvbmVyL055IG1lbnVwbGFuIDIwMjAgMTEuVG9yc2RhZyB1Z2UgMi5kb2N4L2dvb2dsZV9kcml2ZV9kYXRh","name":"Ny menuplan 2020 11.Torsdag uge 2","filename":"Ny menuplan 2020 11.Torsdag uge 2.docx","path":"/google_drive_data/ALL FOLDERS (1)/B/00.Alt fra bispebjerg samlet/Menuplaner/Ny menuplan, skabeloner/Ny menuplan 2020 11.Torsdag uge 2.docx","category":"ALL FOLDERS (1)","subCategory":"B","type":"docx","size":1520548,"modified":"2020-06-04T05:47:24.000Z"},{"id":"QUxMIEZPTERFUlMgKDEpL0IvMDAuQWx0IGZyYSBiaXNwZWJqZXJnIHNhbWxldC9NZW51cGxhbmVyL055IG1lbnVwbGFuLCBza2FiZWxvbmVyL055IG1lbnVwbGFuIDIwMjAgMTIuRnJlZGFnIHVnZSAyLmRvY3gvZ29vZ2xlX2RyaXZlX2RhdGE=","name":"Ny menuplan 2020 12.Fredag uge 2","filename":"Ny menuplan 2020 12.Fredag uge 2.docx","path":"/google_drive_data/ALL FOLDERS (1)/B/00.Alt fra bispebjerg samlet/Menuplaner/Ny menuplan, skabeloner/Ny menuplan 2020 12.Fredag uge 2.docx","category":"ALL FOLDERS (1)","subCategory":"B","type":"docx","size":1520632,"modified":"2020-06-04T06:00:07.000Z"},{"id":"QUxMIEZPTERFUlMgKDEpL0IvMDAuQWx0IGZyYSBiaXNwZWJqZXJnIHNhbWxldC9NZW51cGxhbmVyL055IG1lbnVwbGFuLCBza2FiZWxvbmVyL055IG1lbnVwbGFuIDIwMjAgMTMuTMO4cmRhZyB1Z2UgMi5kb2N4L2dvb2dsZV9kcml2ZV9kYXRh","name":"Ny menuplan 2020 13.Lørdag uge 2","filename":"Ny menuplan 2020 13.Lørdag uge 2.docx","path":"/google_drive_data/ALL FOLDERS (1)/B/00.Alt fra bispebjerg samlet/Menuplaner/Ny menuplan, skabeloner/Ny menuplan 2020 13.Lørdag uge 2.docx","category":"ALL FOLDERS (1)","subCategory":"B","type":"docx","size":1520580,"modified":"2020-06-04T06:08:29.000Z"},{"id":"QUxMIEZPTERFUlMgKDEpL0IvMDAuQWx0IGZyYSBiaXNwZWJqZXJnIHNhbWxldC9NZW51cGxhbmVyL055IG1lbnVwbGFuLCBza2FiZWxvbmVyL055IG1lbnVwbGFuIDIwMjAgMTQuU8O4bmRhZyB1Z2UgMi5kb2N4L2dvb2dsZV9kcml2ZV9kYXRh","name":"Ny menuplan 2020 14.Søndag uge 2","filename":"Ny menuplan 2020 14.Søndag uge 2.docx","path":"/google_drive_data/ALL FOLDERS (1)/B/00.Alt fra bispebjerg samlet/Menuplaner/Ny menuplan, skabeloner/Ny menuplan 2020 14.Søndag uge 2.docx","category":"ALL FOLDERS (1)","subCategory":"B","type":"docx","size":1520608,"modified":"2020-06-04T06:17:24.000Z"},{"id":"QUxMIEZPTERFUlMgKDEpL0IvMDAuQWx0IGZyYSBiaXNwZWJqZXJnIHNhbWxldC9NZW51cGxhbmVyL055IG1lbnVwbGFuLCBza2FiZWxvbmVyL055IG1lbnVwbGFuIDIwMjAgMi5UaXJzZGFnIHVnZSAxLmRvY3gvZ29vZ2xlX2RyaXZlX2RhdGE=","name":"Ny menuplan 2020 2.Tirsdag uge 1","filename":"Ny menuplan 2020 2.Tirsdag uge 1.docx","path":"/google_drive_data/ALL FOLDERS (1)/B/00.Alt fra bispebjerg samlet/Menuplaner/Ny menuplan, skabeloner/Ny menuplan 2020 2.Tirsdag uge 1.docx","category":"ALL FOLDERS (1)","subCategory":"B","type":"docx","size":1520776,"modified":"2020-06-04T05:48:15.000Z"},{"id":"QUxMIEZPTERFUlMgKDEpL0IvMDAuQWx0IGZyYSBiaXNwZWJqZXJnIHNhbWxldC9NZW51cGxhbmVyL055IG1lbnVwbGFuLCBza2FiZWxvbmVyL055IG1lbnVwbGFuIDIwMjAgMy5PbnNkYWcgdWdlIDEuZG9jeC9nb29nbGVfZHJpdmVfZGF0YQ==","name":"Ny menuplan 2020 3.Onsdag uge 1","filename":"Ny menuplan 2020 3.Onsdag uge 1.docx","path":"/google_drive_data/ALL FOLDERS (1)/B/00.Alt fra bispebjerg samlet/Menuplaner/Ny menuplan, skabeloner/Ny menuplan 2020 3.Onsdag uge 1.docx","category":"ALL FOLDERS (1)","subCategory":"B","type":"docx","size":1520676,"modified":"2020-06-04T08:44:05.000Z"},{"id":"QUxMIEZPTERFUlMgKDEpL0IvMDAuQWx0IGZyYSBiaXNwZWJqZXJnIHNhbWxldC9NZW51cGxhbmVyL055IG1lbnVwbGFuLCBza2FiZWxvbmVyL055IG1lbnVwbGFuIDIwMjAgNC5Ub3JzZGFnIHVnZSAxLmRvY3gvZ29vZ2xlX2RyaXZlX2RhdGE=","name":"Ny menuplan 2020 4.Torsdag uge 1","filename":"Ny menuplan 2020 4.Torsdag uge 1.docx","path":"/google_drive_data/ALL FOLDERS (1)/B/00.Alt fra bispebjerg samlet/Menuplaner/Ny menuplan, skabeloner/Ny menuplan 2020 4.Torsdag uge 1.docx","category":"ALL FOLDERS (1)","subCategory":"B","type":"docx","size":1520586,"modified":"2020-06-04T08:46:22.000Z"},{"id":"QUxMIEZPTERFUlMgKDEpL0IvMDAuQWx0IGZyYSBiaXNwZWJqZXJnIHNhbWxldC9NZW51cGxhbmVyL055IG1lbnVwbGFuLCBza2FiZWxvbmVyL055IG1lbnVwbGFuIDIwMjAgNS5GcmVkYWcgdWdlIDEuZG9jeC9nb29nbGVfZHJpdmVfZGF0YQ==","name":"Ny menuplan 2020 5.Fredag uge 1","filename":"Ny menuplan 2020 5.Fredag uge 1.docx","path":"/google_drive_data/ALL FOLDERS (1)/B/00.Alt fra bispebjerg samlet/Menuplaner/Ny menuplan, skabeloner/Ny menuplan 2020 5.Fredag uge 1.docx","category":"ALL FOLDERS (1)","subCategory":"B","type":"docx","size":1520698,"modified":"2020-06-04T08:47:38.000Z"},{"id":"QUxMIEZPTERFUlMgKDEpL0IvMDAuQWx0IGZyYSBiaXNwZWJqZXJnIHNhbWxldC9NZW51cGxhbmVyL055IG1lbnVwbGFuLCBza2FiZWxvbmVyL055IG1lbnVwbGFuIDIwMjAgNi5Mw7hyZGFnIHVnZSAxLmRvY3gvZ29vZ2xlX2RyaXZlX2RhdGE=","name":"Ny menuplan 2020 6.Lørdag uge 1","filename":"Ny menuplan 2020 6.Lørdag uge 1.docx","path":"/google_drive_data/ALL FOLDERS (1)/B/00.Alt fra bispebjerg samlet/Menuplaner/Ny menuplan, skabeloner/Ny menuplan 2020 6.Lørdag uge 1.docx","category":"ALL FOLDERS (1)","subCategory":"B","type":"docx","size":1520585,"modified":"2020-06-04T08:48:14.000Z"},{"id":"QUxMIEZPTERFUlMgKDEpL0IvMDAuQWx0IGZyYSBiaXNwZWJqZXJnIHNhbWxldC9NZW51cGxhbmVyL055IG1lbnVwbGFuLCBza2FiZWxvbmVyL055IG1lbnVwbGFuIDIwMjAgNy5Tw7huZGFnIHVnZSAxLmRvY3gvZ29vZ2xlX2RyaXZlX2RhdGE=","name":"Ny menuplan 2020 7.Søndag uge 1","filename":"Ny menuplan 2020 7.Søndag uge 1.docx","path":"/google_drive_data/ALL FOLDERS (1)/B/00.Alt fra bispebjerg samlet/Menuplaner/Ny menuplan, skabeloner/Ny menuplan 2020 7.Søndag uge 1.docx","category":"ALL FOLDERS (1)","subCategory":"B","type":"docx","size":1520536,"modified":"2020-06-04T08:48:41.000Z"},{"id":"QUxMIEZPTERFUlMgKDEpL0IvMDAuQWx0IGZyYSBiaXNwZWJqZXJnIHNhbWxldC9NZW51cGxhbmVyL055IG1lbnVwbGFuLCBza2FiZWxvbmVyL055IG1lbnVwbGFuIDIwMjAgOC5NYW5kYWcgdWdlIDIuZG9jeC9nb29nbGVfZHJpdmVfZGF0YQ==","name":"Ny menuplan 2020 8.Mandag uge 2","filename":"Ny menuplan 2020 8.Mandag uge 2.docx","path":"/google_drive_data/ALL FOLDERS (1)/B/00.Alt fra bispebjerg samlet/Menuplaner/Ny menuplan, skabeloner/Ny menuplan 2020 8.Mandag uge 2.docx","category":"ALL FOLDERS (1)","subCategory":"B","type":"docx","size":1527340,"modified":"2020-06-04T07:59:23.000Z"},{"id":"QUxMIEZPTERFUlMgKDEpL0IvMDAuQWx0IGZyYSBiaXNwZWJqZXJnIHNhbWxldC9NZW51cGxhbmVyL055IG1lbnVwbGFuLCBza2FiZWxvbmVyL055IG1lbnVwbGFuIDIwMjAgOS5UaXJzZGFnIHVnZSAyLmRvY3gvZ29vZ2xlX2RyaXZlX2RhdGE=","name":"Ny menuplan 2020 9.Tirsdag uge 2","filename":"Ny menuplan 2020 9.Tirsdag uge 2.docx","path":"/google_drive_data/ALL FOLDERS (1)/B/00.Alt fra bispebjerg samlet/Menuplaner/Ny menuplan, skabeloner/Ny menuplan 2020 9.Tirsdag uge 2.docx","category":"ALL FOLDERS (1)","subCategory":"B","type":"docx","size":1520776,"modified":"2020-06-05T05:39:41.000Z"},{"id":"QUxMIEZPTERFUlMgKDEpL0IvMDAuQWx0IGZyYSBiaXNwZWJqZXJnIHNhbWxldC9NZW51cGxhbmVyL055IG1lbnVwbGFuLCBza2FiZWxvbmVyL055IG1lbnVwbGFuIDIwMjAuZG9jeC9nb29nbGVfZHJpdmVfZGF0YQ==","name":"Ny menuplan 2020","filename":"Ny menuplan 2020.docx","path":"/google_drive_data/ALL FOLDERS (1)/B/00.Alt fra bispebjerg samlet/Menuplaner/Ny menuplan, skabeloner/Ny menuplan 2020.docx","category":"ALL FOLDERS (1)","subCategory":"B","type":"docx","size":1520294,"modified":"2020-05-13T04:30:36.000Z"},{"id":"QUxMIEZPTERFUlMgKDEpL0IvMDAuQWx0IGZyYSBiaXNwZWJqZXJnIHNhbWxldC9NZW51cGxhbmVyL055ZSBvcHNrcmlmdGVyIHRpbCBhZnRlbi9PcHNrcmlmdGVyIGxhZ3QgaW5kIGkgTUNTIHRpbCBueSBwbGFuLnBkZi9nb29nbGVfZHJpdmVfZGF0YQ==","name":"Opskrifter lagt ind i MCS til ny plan","filename":"Opskrifter lagt ind i MCS til ny plan.pdf","path":"/google_drive_data/ALL FOLDERS (1)/B/00.Alt fra bispebjerg samlet/Menuplaner/Nye opskrifter til aften/Opskrifter lagt ind i MCS til ny plan.pdf","category":"ALL FOLDERS (1)","subCategory":"B","type":"pdf","size":112681,"modified":"2016-05-24T05:45:21.000Z"},{"id":"QUxMIEZPTERFUlMgKDEpL0IvMDAuQWx0IGZyYSBiaXNwZWJqZXJnIHNhbWxldC9NZW51cGxhbmVyL21lbnVwbGFuIHVkZW4gZnJva29zdCAyMDI0LCBzb21tZXIuZG9jeC9nb29nbGVfZHJpdmVfZGF0YQ==","name":"menuplan uden frokost 2024, sommer","filename":"menuplan uden frokost 2024, sommer.docx","path":"/google_drive_data/ALL FOLDERS (1)/B/00.Alt fra bispebjerg samlet/Menuplaner/menuplan uden frokost 2024, sommer.docx","category":"ALL FOLDERS (1)","subCategory":"B","type":"docx","size":1547107,"modified":"2024-05-27T07:35:32.000Z"},{"id":"QUxMIEZPTERFUlMgKDEpL0IvMDAuQWx0IGZyYSBiaXNwZWJqZXJnIHNhbWxldC9NaXNvcHJvamVrdCBLUC9HYW50dCBtaXNvLmRvY3gvZ29vZ2xlX2RyaXZlX2RhdGE=","name":"Gantt miso","filename":"Gantt miso.docx","path":"/google_drive_data/ALL FOLDERS (1)/B/00.Alt fra bispebjerg samlet/Misoprojekt KP/Gantt miso.docx","category":"ALL FOLDERS (1)","subCategory":"B","type":"docx","size":14836,"modified":"2024-07-04T07:27:17.000Z"},{"id":"QUxMIEZPTERFUlMgKDEpL0IvMDAuQWx0IGZyYSBiaXNwZWJqZXJnIHNhbWxldC9NaXNvcHJvamVrdCBLUC9NaXNvcHJvamVrdC5kb2N4L2dvb2dsZV9kcml2ZV9kYXRh","name":"Misoprojekt","filename":"Misoprojekt.docx","path":"/google_drive_data/ALL FOLDERS (1)/B/00.Alt fra bispebjerg samlet/Misoprojekt KP/Misoprojekt.docx","category":"ALL FOLDERS (1)","subCategory":"B","type":"docx","size":13263,"modified":"2024-07-04T06:06:37.000Z"},{"id":"QUxMIEZPTERFUlMgKDEpL0IvMDAuQWx0IGZyYSBiaXNwZWJqZXJnIHNhbWxldC9NaXNvcHJvamVrdCBLUC9Nw7hkZSBtZWQgS1AgbWlzbyBwcm9qZWt0LmRvY3gvZ29vZ2xlX2RyaXZlX2RhdGE=","name":"Møde med KP miso projekt","filename":"Møde med KP miso projekt.docx","path":"/google_drive_data/ALL FOLDERS (1)/B/00.Alt fra bispebjerg samlet/Misoprojekt KP/Møde med KP miso projekt.docx","category":"ALL FOLDERS (1)","subCategory":"B","type":"docx","size":13778,"modified":"2024-03-11T11:50:04.000Z"},{"id":"QUxMIEZPTERFUlMgKDEpL0IvMDAuQWx0IGZyYSBiaXNwZWJqZXJnIHNhbWxldC9NaXNvcHJvamVrdCBLUC9Qcm9qZWt0IEJBL0JhY2hlbG9yIG9wZ2F2ZSwgQ2FtaWxsYSwgVGhlYSwgUGhpbGlwLnBkZi9nb29nbGVfZHJpdmVfZGF0YQ==","name":"Bachelor opgave, Camilla, Thea, Philip","filename":"Bachelor opgave, Camilla, Thea, Philip.pdf","path":"/google_drive_data/ALL FOLDERS (1)/B/00.Alt fra bispebjerg samlet/Misoprojekt KP/Projekt BA/Bachelor opgave, Camilla, Thea, Philip.pdf","category":"ALL FOLDERS (1)","subCategory":"B","type":"pdf","size":6251292,"modified":"2024-06-16T11:20:51.000Z"},{"id":"QUxMIEZPTERFUlMgKDEpL0IvMDAuQWx0IGZyYSBiaXNwZWJqZXJnIHNhbWxldC9NaXNvcHJvamVrdCBLUC9Tw7hka2FydG9mZmVsbWFkLzEgbWFkLmpwZy9nb29nbGVfZHJpdmVfZGF0YQ==","name":"1 mad","filename":"1 mad.jpg","path":"/google_drive_data/ALL FOLDERS (1)/B/00.Alt fra bispebjerg samlet/Misoprojekt KP/Sødkartoffelmad/1 mad.jpg","category":"ALL FOLDERS (1)","subCategory":"B","type":"jpg","size":2021451,"modified":"2024-04-26T04:41:02.000Z"},{"id":"QUxMIEZPTERFUlMgKDEpL0IvMDAuQWx0IGZyYSBiaXNwZWJqZXJnIHNhbWxldC9NaXNvcHJvamVrdCBLUC9Tw7hka2FydG9mZmVsbWFkLzIgbWFkLmpwZy9nb29nbGVfZHJpdmVfZGF0YQ==","name":"2 mad","filename":"2 mad.jpg","path":"/google_drive_data/ALL FOLDERS (1)/B/00.Alt fra bispebjerg samlet/Misoprojekt KP/Sødkartoffelmad/2 mad.jpg","category":"ALL FOLDERS (1)","subCategory":"B","type":"jpg","size":1473942,"modified":"2024-04-26T04:40:41.000Z"},{"id":"QUxMIEZPTERFUlMgKDEpL0IvMDAuQWx0IGZyYSBiaXNwZWJqZXJnIHNhbWxldC9NaXNvcHJvamVrdCBLUC9Tw7hka2FydG9mZmVsbWFkLzMgbWFkLmpwZy9nb29nbGVfZHJpdmVfZGF0YQ==","name":"3 mad","filename":"3 mad.jpg","path":"/google_drive_data/ALL FOLDERS (1)/B/00.Alt fra bispebjerg samlet/Misoprojekt KP/Sødkartoffelmad/3 mad.jpg","category":"ALL FOLDERS (1)","subCategory":"B","type":"jpg","size":1320108,"modified":"2024-04-26T04:39:52.000Z"},{"id":"QUxMIEZPTERFUlMgKDEpL0IvMDAuQWx0IGZyYSBiaXNwZWJqZXJnIHNhbWxldC9NaXNvcHJvamVrdCBLUC9Tw7hka2FydG9mZmVsbWFkLzQgbWFkLmpwZy9nb29nbGVfZHJpdmVfZGF0YQ==","name":"4 mad","filename":"4 mad.jpg","path":"/google_drive_data/ALL FOLDERS (1)/B/00.Alt fra bispebjerg samlet/Misoprojekt KP/Sødkartoffelmad/4 mad.jpg","category":"ALL FOLDERS (1)","subCategory":"B","type":"jpg","size":1521265,"modified":"2024-04-26T04:39:28.000Z"},{"id":"QUxMIEZPTERFUlMgKDEpL0IvMDAuQWx0IGZyYSBiaXNwZWJqZXJnIHNhbWxldC9NaXNvcHJvamVrdCBLUC9rdml0dGVyaW5nIGtvamkgc3BvcmVyLnBkZi9nb29nbGVfZHJpdmVfZGF0YQ==","name":"kvittering koji sporer","filename":"kvittering koji sporer.pdf","path":"/google_drive_data/ALL FOLDERS (1)/B/00.Alt fra bispebjerg samlet/Misoprojekt KP/kvittering koji sporer.pdf","category":"ALL FOLDERS (1)","subCategory":"B","type":"pdf","size":14255,"modified":"2024-03-26T11:18:38.000Z"},{"id":"QUxMIEZPTERFUlMgKDEpL0IvMDAuQWx0IGZyYSBiaXNwZWJqZXJnIHNhbWxldC9NaXNvcHJvamVrdCBLUC91ZGzDpmcgTWlzby1wcm9qZWt0LnBkZi9nb29nbGVfZHJpdmVfZGF0YQ==","name":"udlæg Miso-projekt","filename":"udlæg Miso-projekt.pdf","path":"/google_drive_data/ALL FOLDERS (1)/B/00.Alt fra bispebjerg samlet/Misoprojekt KP/udlæg Miso-projekt.pdf","category":"ALL FOLDERS (1)","subCategory":"B","type":"pdf","size":308371,"modified":"2024-04-11T07:59:46.000Z"},{"id":"QUxMIEZPTERFUlMgKDEpL0IvMDAuQWx0IGZyYSBiaXNwZWJqZXJnIHNhbWxldC9PbmVOb3RlIFVwbG9hZHMvUHJvdGVpbiBkcmlua19vcHNrcmlmdC5QREYvZ29vZ2xlX2RyaXZlX2RhdGE=","name":"Protein drink_opskrift.PDF","filename":"Protein drink_opskrift.PDF","path":"/google_drive_data/ALL FOLDERS (1)/B/00.Alt fra bispebjerg samlet/OneNote Uploads/Protein drink_opskrift.PDF","category":"ALL FOLDERS (1)","subCategory":"B","type":"pdf","size":49250,"modified":"2025-02-11T09:23:06.000Z"},{"id":"QUxMIEZPTERFUlMgKDEpL0IvMDAuQWx0IGZyYSBiaXNwZWJqZXJnIHNhbWxldC9PcHJza3JpZnRlciBmcmEgdmVqbGUvQnlnb3R0byBrdWdsZXIgbWVkIGJsw6Zrc3BydXR0ZS5kb2N4L2dvb2dsZV9kcml2ZV9kYXRh","name":"Bygotto kugler med blæksprutte","filename":"Bygotto kugler med blæksprutte.docx","path":"/google_drive_data/ALL FOLDERS (1)/B/00.Alt fra bispebjerg samlet/Oprskrifter fra vejle/Bygotto kugler med blæksprutte.docx","category":"ALL FOLDERS (1)","subCategory":"B","type":"docx","size":108876,"modified":"2024-06-30T06:57:00.000Z"},{"id":"QUxMIEZPTERFUlMgKDEpL0IvMDAuQWx0IGZyYSBiaXNwZWJqZXJnIHNhbWxldC9PcHJza3JpZnRlciBmcmEgdmVqbGUvQ2l0cm9ubWFyaW5lcmV0IGluZ3JpZMOmcnRlci5kb2N4L2dvb2dsZV9kcml2ZV9kYXRh","name":"Citronmarineret ingridærter","filename":"Citronmarineret ingridærter.docx","path":"/google_drive_data/ALL FOLDERS (1)/B/00.Alt fra bispebjerg samlet/Oprskrifter fra vejle/Citronmarineret ingridærter.docx","category":"ALL FOLDERS (1)","subCategory":"B","type":"docx","size":97107,"modified":"2024-06-30T07:00:00.000Z"},{"id":"QUxMIEZPTERFUlMgKDEpL0IvMDAuQWx0IGZyYSBiaXNwZWJqZXJnIHNhbWxldC9PcHJza3JpZnRlciBmcmEgdmVqbGUvQ3JlbWUgYWYgaGVzdGViw7hubmUgbWVkIGVzdHJhZ29uLmRvY3gvZ29vZ2xlX2RyaXZlX2RhdGE=","name":"Creme af hestebønne med estragon","filename":"Creme af hestebønne med estragon.docx","path":"/google_drive_data/ALL FOLDERS (1)/B/00.Alt fra bispebjerg samlet/Oprskrifter fra vejle/Creme af hestebønne med estragon.docx","category":"ALL FOLDERS (1)","subCategory":"B","type":"docx","size":103002,"modified":"2024-06-30T07:02:00.000Z"},{"id":"QUxMIEZPTERFUlMgKDEpL0IvMDAuQWx0IGZyYSBiaXNwZWJqZXJnIHNhbWxldC9PcHJza3JpZnRlciBmcmEgdmVqbGUvRmzDuGRlY3JlbWUgbWVkIGhlc3RlYsO4bm5lciBldnQgcGx1cyB2YW5pbGxlLmRvY3gvZ29vZ2xlX2RyaXZlX2RhdGE=","name":"Flødecreme med hestebønner evt plus vanille","filename":"Flødecreme med hestebønner evt plus vanille.docx","path":"/google_drive_data/ALL FOLDERS (1)/B/00.Alt fra bispebjerg samlet/Oprskrifter fra vejle/Flødecreme med hestebønner evt plus vanille.docx","category":"ALL FOLDERS (1)","subCategory":"B","type":"docx","size":94195,"modified":"2024-06-30T07:04:00.000Z"},{"id":"QUxMIEZPTERFUlMgKDEpL0IvMDAuQWx0IGZyYSBiaXNwZWJqZXJnIHNhbWxldC9PcHJza3JpZnRlciBmcmEgdmVqbGUvSW5kaXNrIGzDuGcgQmFoamkuZG9jeC9nb29nbGVfZHJpdmVfZGF0YQ==","name":"Indisk løg Bahji","filename":"Indisk løg Bahji.docx","path":"/google_drive_data/ALL FOLDERS (1)/B/00.Alt fra bispebjerg samlet/Oprskrifter fra vejle/Indisk løg Bahji.docx","category":"ALL FOLDERS (1)","subCategory":"B","type":"docx","size":98679,"modified":"2024-06-30T06:53:00.000Z"},{"id":"QUxMIEZPTERFUlMgKDEpL0IvMDAuQWx0IGZyYSBiaXNwZWJqZXJnIHNhbWxldC9PcHJza3JpZnRlciBmcmEgdmVqbGUvTWFrcm9uc25pdHRlciBtZWQgYsOmbGdmcnVndGVyLmRvY3gvZ29vZ2xlX2RyaXZlX2RhdGE=","name":"Makronsnitter med bælgfrugter","filename":"Makronsnitter med bælgfrugter.docx","path":"/google_drive_data/ALL FOLDERS (1)/B/00.Alt fra bispebjerg samlet/Oprskrifter fra vejle/Makronsnitter med bælgfrugter.docx","category":"ALL FOLDERS (1)","subCategory":"B","type":"docx","size":101537,"modified":"2024-06-30T07:06:00.000Z"},{"id":"QUxMIEZPTERFUlMgKDEpL0IvMDAuQWx0IGZyYSBiaXNwZWJqZXJnIHNhbWxldC9PcHJza3JpZnRlciBmcmEgdmVqbGUvTW9qbyBwZWJlcmZydWd0IGRpcCBtZWQgbGluc2VyX3RpbCBwaXJvZ2dlci5kb2N4L2dvb2dsZV9kcml2ZV9kYXRh","name":"Mojo peberfrugt dip med linser_til pirogger","filename":"Mojo peberfrugt dip med linser_til pirogger.docx","path":"/google_drive_data/ALL FOLDERS (1)/B/00.Alt fra bispebjerg samlet/Oprskrifter fra vejle/Mojo peberfrugt dip med linser_til pirogger.docx","category":"ALL FOLDERS (1)","subCategory":"B","type":"docx","size":104372,"modified":"2024-06-30T07:09:00.000Z"},{"id":"QUxMIEZPTERFUlMgKDEpL0IvMDAuQWx0IGZyYSBiaXNwZWJqZXJnIHNhbWxldC9PcHJza3JpZnRlciBmcmEgdmVqbGUvUGlyb2dnZXIgbWVkIGxpbnNlci5kb2N4L2dvb2dsZV9kcml2ZV9kYXRh","name":"Pirogger med linser","filename":"Pirogger med linser.docx","path":"/google_drive_data/ALL FOLDERS (1)/B/00.Alt fra bispebjerg samlet/Oprskrifter fra vejle/Pirogger med linser.docx","category":"ALL FOLDERS (1)","subCategory":"B","type":"docx","size":109671,"modified":"2024-06-30T07:25:00.000Z"},{"id":"QUxMIEZPTERFUlMgKDEpL0IvMDAuQWx0IGZyYSBiaXNwZWJqZXJnIHNhbWxldC9PcHJza3JpZnRlciBmcmEgdmVqbGUvU21vb3RoaWUgbWVkIGLDpmxnLmRvY3gvZ29vZ2xlX2RyaXZlX2RhdGE=","name":"Smoothie med bælg","filename":"Smoothie med bælg.docx","path":"/google_drive_data/ALL FOLDERS (1)/B/00.Alt fra bispebjerg samlet/Oprskrifter fra vejle/Smoothie med bælg.docx","category":"ALL FOLDERS (1)","subCategory":"B","type":"docx","size":101585,"modified":"2024-06-30T07:30:00.000Z"},{"id":"QUxMIEZPTERFUlMgKDEpL0IvMDAuQWx0IGZyYSBiaXNwZWJqZXJnIHNhbWxldC9PcHJza3JpZnRlciBmcmEgdmVqbGUvVmFuZGJha2tlbHNlIG1lZCDDpnJ0ZW1lbC5kb2N4L2dvb2dsZV9kcml2ZV9kYXRh","name":"Vandbakkelse med ærtemel","filename":"Vandbakkelse med ærtemel.docx","path":"/google_drive_data/ALL FOLDERS (1)/B/00.Alt fra bispebjerg samlet/Oprskrifter fra vejle/Vandbakkelse med ærtemel.docx","category":"ALL FOLDERS (1)","subCategory":"B","type":"docx","size":99959,"modified":"2024-06-30T07:31:00.000Z"},{"id":"QUxMIEZPTERFUlMgKDEpL0IvMDAuQWx0IGZyYSBiaXNwZWJqZXJnIHNhbWxldC9QT1dFUlBPSU5UIFRJTCBUWVNLTEFORC9hzIpkYWwgw7hycmVkLmpwZy9nb29nbGVfZHJpdmVfZGF0YQ==","name":"ådal ørred","filename":"ådal ørred.jpg","path":"/google_drive_data/ALL FOLDERS (1)/B/00.Alt fra bispebjerg samlet/POWERPOINT TIL TYSKLAND/ådal ørred.jpg","category":"ALL FOLDERS (1)","subCategory":"B","type":"jpg","size":445992,"modified":"2023-11-21T06:21:51.000Z"},{"id":"QUxMIEZPTERFUlMgKDEpL0IvMDAuQWx0IGZyYSBiaXNwZWJqZXJnIHNhbWxldC9QUk9KRUtUIEFTSElTIDIwMjMtMjA1LygxKSBQcm9qZWN0cyBfIEFzaGlzIEdhdXRhbSBfIExpbmtlZEluLnBkZi9nb29nbGVfZHJpdmVfZGF0YQ==","name":"(1) Projects _ Ashis Gautam _ LinkedIn","filename":"(1) Projects _ Ashis Gautam _ LinkedIn.pdf","path":"/google_drive_data/ALL FOLDERS (1)/B/00.Alt fra bispebjerg samlet/PROJEKT ASHIS 2023-205/(1) Projects _ Ashis Gautam _ LinkedIn.pdf","category":"ALL FOLDERS (1)","subCategory":"B","type":"pdf","size":8275127,"modified":"2025-03-27T12:15:55.000Z"},{"id":"QUxMIEZPTERFUlMgKDEpL0IvMDAuQWx0IGZyYSBiaXNwZWJqZXJnIHNhbWxldC9QUk9KRUtUIEFTSElTIDIwMjMtMjA1L0FzaGlzIEdhdXRhbSAtIEFyYmVqZHNvcGdhdmVzcHLDpnNlbnRhdGlvbl8yMDI1LnBkZi9nb29nbGVfZHJpdmVfZGF0YQ==","name":"Ashis Gautam - Arbejdsopgavespræsentation_2025","filename":"Ashis Gautam - Arbejdsopgavespræsentation_2025.pdf","path":"/google_drive_data/ALL FOLDERS (1)/B/00.Alt fra bispebjerg samlet/PROJEKT ASHIS 2023-205/Ashis Gautam - Arbejdsopgavespræsentation_2025.pdf","category":"ALL FOLDERS (1)","subCategory":"B","type":"pdf","size":135086,"modified":"2025-03-27T12:37:00.000Z"},{"id":"QUxMIEZPTERFUlMgKDEpL0IvMDAuQWx0IGZyYSBiaXNwZWJqZXJnIHNhbWxldC9QUk9KRUtUIEFTSElTIDIwMjMtMjA1L0FzaGlzX3Byb2pla3Rfc3RhdHVzXzIwMjNfMjAyNS5wZGYvZ29vZ2xlX2RyaXZlX2RhdGE=","name":"Ashis_projekt_status_2023_2025","filename":"Ashis_projekt_status_2023_2025.pdf","path":"/google_drive_data/ALL FOLDERS (1)/B/00.Alt fra bispebjerg samlet/PROJEKT ASHIS 2023-205/Ashis_projekt_status_2023_2025.pdf","category":"ALL FOLDERS (1)","subCategory":"B","type":"pdf","size":46522,"modified":"2025-03-27T12:15:42.000Z"},{"id":"QUxMIEZPTERFUlMgKDEpL0IvMDAuQWx0IGZyYSBiaXNwZWJqZXJnIHNhbWxldC9QUk9KRUtUIEFTSElTIDIwMjMtMjA1L0NoYXRHUFQgRGF0YSBFeHBvcnQucGRmL2dvb2dsZV9kcml2ZV9kYXRh","name":"ChatGPT Data Export","filename":"ChatGPT Data Export.pdf","path":"/google_drive_data/ALL FOLDERS (1)/B/00.Alt fra bispebjerg samlet/PROJEKT ASHIS 2023-205/ChatGPT Data Export.pdf","category":"ALL FOLDERS (1)","subCategory":"B","type":"pdf","size":9493627,"modified":"2025-03-27T12:16:44.000Z"},{"id":"QUxMIEZPTERFUlMgKDEpL0IvMDAuQWx0IGZyYSBiaXNwZWJqZXJnIHNhbWxldC9QUk9KRUtUIEFTSElTIDIwMjMtMjA1L0RldGFsamVyZXQgT3ZlcnNpZ3Qgb3ZlciBBc2hpcyBHYXV0YW1zIEFyYmVqZHNvbXJhzIpkZXIgb2cgUHJvLnBkZi9nb29nbGVfZHJpdmVfZGF0YQ==","name":"Detaljeret Oversigt over Ashis Gautams Arbejdsområder og Pro","filename":"Detaljeret Oversigt over Ashis Gautams Arbejdsområder og Pro.pdf","path":"/google_drive_data/ALL FOLDERS (1)/B/00.Alt fra bispebjerg samlet/PROJEKT ASHIS 2023-205/Detaljeret Oversigt over Ashis Gautams Arbejdsområder og Pro.pdf","category":"ALL FOLDERS (1)","subCategory":"B","type":"pdf","size":180632,"modified":"2025-03-27T12:36:46.000Z"},{"id":"QUxMIEZPTERFUlMgKDEpL0IvMDAuQWx0IGZyYSBiaXNwZWJqZXJnIHNhbWxldC9QUk9KRUtUIEFTSElTIDIwMjMtMjA1L1BST0pFS1QgTUlTTy9QaGlsaXAvS8OmcmUgUGhpbGlwIFJvc2VucXVpc3QuZG9jeC9nb29nbGVfZHJpdmVfZGF0YQ==","name":"Kære Philip Rosenquist","filename":"Kære Philip Rosenquist.docx","path":"/google_drive_data/ALL FOLDERS (1)/B/00.Alt fra bispebjerg samlet/PROJEKT ASHIS 2023-205/PROJEKT MISO/Philip/Kære Philip Rosenquist.docx","category":"ALL FOLDERS (1)","subCategory":"B","type":"docx","size":23741,"modified":"2024-07-24T05:09:33.000Z"},{"id":"QUxMIEZPTERFUlMgKDEpL0IvMDAuQWx0IGZyYSBiaXNwZWJqZXJnIHNhbWxldC9QUk9KRUtUIEFTSElTIDIwMjMtMjA1L1BST0pFS1QgTUlTTy9QaGlsaXAvUGhpbGlwX1Jvc2VucXVpc3RfOC11Z2VycyBzYW10YWxlXzEuMTAuMjAyNC5wZGYvZ29vZ2xlX2RyaXZlX2RhdGE=","name":"Philip_Rosenquist_8-ugers samtale_1.10.2024","filename":"Philip_Rosenquist_8-ugers samtale_1.10.2024.pdf","path":"/google_drive_data/ALL FOLDERS (1)/B/00.Alt fra bispebjerg samlet/PROJEKT ASHIS 2023-205/PROJEKT MISO/Philip/Philip_Rosenquist_8-ugers samtale_1.10.2024.pdf","category":"ALL FOLDERS (1)","subCategory":"B","type":"pdf","size":292159,"modified":"2024-10-09T07:09:25.000Z"},{"id":"QUxMIEZPTERFUlMgKDEpL0IvMDAuQWx0IGZyYSBiaXNwZWJqZXJnIHNhbWxldC9QUk9KRUtUIEFTSElTIDIwMjMtMjA1L1BST0pFS1QgTUlTTy9UaGUgTm9tYSBHdWlkZSB0byBGZXJtZW50YXRpb24ucGRmL2dvb2dsZV9kcml2ZV9kYXRh","name":"The Noma Guide to Fermentation","filename":"The Noma Guide to Fermentation.pdf","path":"/google_drive_data/ALL FOLDERS (1)/B/00.Alt fra bispebjerg samlet/PROJEKT ASHIS 2023-205/PROJEKT MISO/The Noma Guide to Fermentation.pdf","category":"ALL FOLDERS (1)","subCategory":"B","type":"pdf","size":33211196,"modified":"2024-08-01T04:28:35.000Z"},{"id":"QUxMIEZPTERFUlMgKDEpL0IvMDAuQWx0IGZyYSBiaXNwZWJqZXJnIHNhbWxldC9QUk9KRUtUIEFTSElTIDIwMjMtMjA1L1RhbmcvdGFuZyBicnVnZXIgdGVzdC90YW5nIDEucGRmL2dvb2dsZV9kcml2ZV9kYXRh","name":"tang 1","filename":"tang 1.pdf","path":"/google_drive_data/ALL FOLDERS (1)/B/00.Alt fra bispebjerg samlet/PROJEKT ASHIS 2023-205/Tang/tang bruger test/tang 1.pdf","category":"ALL FOLDERS (1)","subCategory":"B","type":"pdf","size":361499,"modified":"2025-02-05T09:59:31.000Z"},{"id":"QUxMIEZPTERFUlMgKDEpL0IvMDAuQWx0IGZyYSBiaXNwZWJqZXJnIHNhbWxldC9QUk9KRUtUIEFTSElTIDIwMjMtMjA1L1RhbmcvdGFuZyBicnVnZXIgdGVzdC90YW5nIDIucGRmL2dvb2dsZV9kcml2ZV9kYXRh","name":"tang 2","filename":"tang 2.pdf","path":"/google_drive_data/ALL FOLDERS (1)/B/00.Alt fra bispebjerg samlet/PROJEKT ASHIS 2023-205/Tang/tang bruger test/tang 2.pdf","category":"ALL FOLDERS (1)","subCategory":"B","type":"pdf","size":382797,"modified":"2025-02-05T09:59:47.000Z"},{"id":"QUxMIEZPTERFUlMgKDEpL0IvMDAuQWx0IGZyYSBiaXNwZWJqZXJnIHNhbWxldC9QUk9KRUtUIEFTSElTIDIwMjMtMjA1L2Zvb2Qgb3AgZGF0YS8yNjA1MjAyM19CaXNwZWJqZXJnIFJhcHBvcnRlcmluZy5wZGYvZ29vZ2xlX2RyaXZlX2RhdGE=","name":"26052023_Bispebjerg Rapportering","filename":"26052023_Bispebjerg Rapportering.pdf","path":"/google_drive_data/ALL FOLDERS (1)/B/00.Alt fra bispebjerg samlet/PROJEKT ASHIS 2023-205/food op data/26052023_Bispebjerg Rapportering.pdf","category":"ALL FOLDERS (1)","subCategory":"B","type":"pdf","size":946345,"modified":"2025-03-25T14:19:31.000Z"},{"id":"QUxMIEZPTERFUlMgKDEpL0IvMDAuQWx0IGZyYSBiaXNwZWJqZXJnIHNhbWxldC9QUk9KRUtUIEFTSElTIDIwMjMtMjA1L2Zvb2Qgb3AgZGF0YS9CaXNwZWJqZXJnIFJhcHBvcnRlcmluZyAyLiBtYcyKbGVwZXJpb2RlLnBkZi9nb29nbGVfZHJpdmVfZGF0YQ==","name":"Bispebjerg Rapportering 2. måleperiode","filename":"Bispebjerg Rapportering 2. måleperiode.pdf","path":"/google_drive_data/ALL FOLDERS (1)/B/00.Alt fra bispebjerg samlet/PROJEKT ASHIS 2023-205/food op data/Bispebjerg Rapportering 2. måleperiode.pdf","category":"ALL FOLDERS (1)","subCategory":"B","type":"pdf","size":468123,"modified":"2025-03-25T14:22:27.000Z"},{"id":"QUxMIEZPTERFUlMgKDEpL0IvMDAuQWx0IGZyYSBiaXNwZWJqZXJnIHNhbWxldC9hbGxlIGzDuHNlIGRva3VtZW50ZXIvMS4gQWZyYXBwb3J0ZXJpbmcgYWYgR3JlZW4gYnkgRGVmYXVsdF9hc2hpc19lZGl0aW9uLmRvY3gvZ29vZ2xlX2RyaXZlX2RhdGE=","name":"1. Afrapportering af Green by Default_ashis_edition","filename":"1. Afrapportering af Green by Default_ashis_edition.docx","path":"/google_drive_data/ALL FOLDERS (1)/B/00.Alt fra bispebjerg samlet/alle løse dokumenter/1. Afrapportering af Green by Default_ashis_edition.docx","category":"ALL FOLDERS (1)","subCategory":"B","type":"docx","size":1389580,"modified":"2024-12-06T13:35:07.000Z"},{"id":"QUxMIEZPTERFUlMgKDEpL0IvMDAuQWx0IGZyYSBiaXNwZWJqZXJnIHNhbWxldC9hbGxlIGzDuHNlIGRva3VtZW50ZXIvMjUwNTI1X0NWIEhvdm1hbm4gQmlzcGViamVyZy5wZGYvZ29vZ2xlX2RyaXZlX2RhdGE=","name":"250525_CV Hovmann Bispebjerg","filename":"250525_CV Hovmann Bispebjerg.pdf","path":"/google_drive_data/ALL FOLDERS (1)/B/00.Alt fra bispebjerg samlet/alle løse dokumenter/250525_CV Hovmann Bispebjerg.pdf","category":"ALL FOLDERS (1)","subCategory":"B","type":"pdf","size":63105,"modified":"2025-05-28T05:07:35.000Z"},{"id":"QUxMIEZPTERFUlMgKDEpL0IvMDAuQWx0IGZyYSBiaXNwZWJqZXJnIHNhbWxldC9hbGxlIGzDuHNlIGRva3VtZW50ZXIvNC1rYW50IHRpcCB0b3AuZG9jeC9nb29nbGVfZHJpdmVfZGF0YQ==","name":"4-kant tip top","filename":"4-kant tip top.docx","path":"/google_drive_data/ALL FOLDERS (1)/B/00.Alt fra bispebjerg samlet/alle løse dokumenter/4-kant tip top.docx","category":"ALL FOLDERS (1)","subCategory":"B","type":"docx","size":12628,"modified":"2023-11-22T06:57:44.000Z"},{"id":"QUxMIEZPTERFUlMgKDEpL0IvMDAuQWx0IGZyYSBiaXNwZWJqZXJnIHNhbWxldC9hbGxlIGzDuHNlIGRva3VtZW50ZXIvNHRoIG9nIGp1bHkgTS5kb2N4L2dvb2dsZV9kcml2ZV9kYXRh","name":"4th og july M","filename":"4th og july M.docx","path":"/google_drive_data/ALL FOLDERS (1)/B/00.Alt fra bispebjerg samlet/alle løse dokumenter/4th og july M.docx","category":"ALL FOLDERS (1)","subCategory":"B","type":"docx","size":17979,"modified":"2025-07-02T19:52:15.000Z"},{"id":"QUxMIEZPTERFUlMgKDEpL0IvMDAuQWx0IGZyYSBiaXNwZWJqZXJnIHNhbWxldC9hbGxlIGzDuHNlIGRva3VtZW50ZXIvNTAwIGcgZ3LDpnNrYXJrZXJuZXIuZG9jeC9nb29nbGVfZHJpdmVfZGF0YQ==","name":"500 g græskarkerner","filename":"500 g græskarkerner.docx","path":"/google_drive_data/ALL FOLDERS (1)/B/00.Alt fra bispebjerg samlet/alle løse dokumenter/500 g græskarkerner.docx","category":"ALL FOLDERS (1)","subCategory":"B","type":"docx","size":12331,"modified":"2024-10-22T04:40:17.000Z"},{"id":"QUxMIEZPTERFUlMgKDEpL0IvMDAuQWx0IGZyYSBiaXNwZWJqZXJnIHNhbWxldC9hbGxlIGzDuHNlIGRva3VtZW50ZXIvQU1VIHVkZGFubmVsc2VzYmV2aXMuZG9jeC9nb29nbGVfZHJpdmVfZGF0YQ==","name":"AMU uddannelsesbevis","filename":"AMU uddannelsesbevis.docx","path":"/google_drive_data/ALL FOLDERS (1)/B/00.Alt fra bispebjerg samlet/alle løse dokumenter/AMU uddannelsesbevis.docx","category":"ALL FOLDERS (1)","subCategory":"B","type":"docx","size":15451,"modified":"2023-09-13T10:41:52.000Z"},{"id":"QUxMIEZPTERFUlMgKDEpL0IvMDAuQWx0IGZyYSBiaXNwZWJqZXJnIHNhbWxldC9hbGxlIGzDuHNlIGRva3VtZW50ZXIvQVNISVNfVE9NU19USUxLWVROSU5HLmRvY3gvZ29vZ2xlX2RyaXZlX2RhdGE=","name":"ASHIS_TOMS_TILKYTNING","filename":"ASHIS_TOMS_TILKYTNING.docx","path":"/google_drive_data/ALL FOLDERS (1)/B/00.Alt fra bispebjerg samlet/alle løse dokumenter/ASHIS_TOMS_TILKYTNING.docx","category":"ALL FOLDERS (1)","subCategory":"B","type":"docx","size":10825,"modified":"2025-07-07T19:15:09.000Z"},{"id":"QUxMIEZPTERFUlMgKDEpL0IvMDAuQWx0IGZyYSBiaXNwZWJqZXJnIHNhbWxldC9hbGxlIGzDuHNlIGRva3VtZW50ZXIvQV9sb29rX2luc2lkZS5wZGYvZ29vZ2xlX2RyaXZlX2RhdGE=","name":"A_look_inside","filename":"A_look_inside.pdf","path":"/google_drive_data/ALL FOLDERS (1)/B/00.Alt fra bispebjerg samlet/alle løse dokumenter/A_look_inside.pdf","category":"ALL FOLDERS (1)","subCategory":"B","type":"pdf","size":5411391,"modified":"2025-01-31T05:19:35.000Z"},{"id":"QUxMIEZPTERFUlMgKDEpL0IvMDAuQWx0IGZyYSBiaXNwZWJqZXJnIHNhbWxldC9hbGxlIGzDuHNlIGRva3VtZW50ZXIvQWZyYXBwb3J0ZXJpbmcgSW5kcmV0bmluZyBhZiBBZmRlbGluZ2vDuGtrZW4uZG9jeC9nb29nbGVfZHJpdmVfZGF0YQ==","name":"Afrapportering Indretning af Afdelingkøkken","filename":"Afrapportering Indretning af Afdelingkøkken.docx","path":"/google_drive_data/ALL FOLDERS (1)/B/00.Alt fra bispebjerg samlet/alle løse dokumenter/Afrapportering Indretning af Afdelingkøkken.docx","category":"ALL FOLDERS (1)","subCategory":"B","type":"docx","size":15926,"modified":"2024-10-21T10:08:45.000Z"},{"id":"QUxMIEZPTERFUlMgKDEpL0IvMDAuQWx0IGZyYSBiaXNwZWJqZXJnIHNhbWxldC9hbGxlIGzDuHNlIGRva3VtZW50ZXIvQWZyYXBwb3RlcmluZyBrb3N0a29uY2VwdCBtZWQgbGlua2VkaW4gcG9zdHMuZG9jeC9nb29nbGVfZHJpdmVfZGF0YQ==","name":"Afrappotering kostkoncept med linkedin posts","filename":"Afrappotering kostkoncept med linkedin posts.docx","path":"/google_drive_data/ALL FOLDERS (1)/B/00.Alt fra bispebjerg samlet/alle løse dokumenter/Afrappotering kostkoncept med linkedin posts.docx","category":"ALL FOLDERS (1)","subCategory":"B","type":"docx","size":29958,"modified":"2024-10-20T05:12:30.000Z"},{"id":"QUxMIEZPTERFUlMgKDEpL0IvMDAuQWx0IGZyYSBiaXNwZWJqZXJnIHNhbWxldC9hbGxlIGzDuHNlIGRva3VtZW50ZXIvQW5hbHlzZSBhZiBUaWxmcmVkc2hlZHN1bmRlcnPDuGdlbHNlbiBodHRwc3d3dy5kb2N4L2dvb2dsZV9kcml2ZV9kYXRh","name":"Analyse af Tilfredshedsundersøgelsen httpswww","filename":"Analyse af Tilfredshedsundersøgelsen httpswww.docx","path":"/google_drive_data/ALL FOLDERS (1)/B/00.Alt fra bispebjerg samlet/alle løse dokumenter/Analyse af Tilfredshedsundersøgelsen httpswww.docx","category":"ALL FOLDERS (1)","subCategory":"B","type":"docx","size":24672,"modified":"2024-11-05T07:53:23.000Z"},{"id":"QUxMIEZPTERFUlMgKDEpL0IvMDAuQWx0IGZyYSBiaXNwZWJqZXJnIHNhbWxldC9hbGxlIGzDuHNlIGRva3VtZW50ZXIvQW5vdGhlciBEYXkuZG9jeC9nb29nbGVfZHJpdmVfZGF0YQ==","name":"Another Day","filename":"Another Day.docx","path":"/google_drive_data/ALL FOLDERS (1)/B/00.Alt fra bispebjerg samlet/alle løse dokumenter/Another Day.docx","category":"ALL FOLDERS (1)","subCategory":"B","type":"docx","size":842031,"modified":"2025-07-21T05:55:13.000Z"},{"id":"QUxMIEZPTERFUlMgKDEpL0IvMDAuQWx0IGZyYSBiaXNwZWJqZXJnIHNhbWxldC9hbGxlIGzDuHNlIGRva3VtZW50ZXIvQW5zw7hnbmluZyAmIENWX0vDuGtrZW5jaGVmX1N2YW5lbcO4bGxlbl8yOS4wNi4wMjUuZG9jeC9nb29nbGVfZHJpdmVfZGF0YQ==","name":"Ansøgning & CV_Køkkenchef_Svanemøllen_29.06.025","filename":"Ansøgning & CV_Køkkenchef_Svanemøllen_29.06.025.docx","path":"/google_drive_data/ALL FOLDERS (1)/B/00.Alt fra bispebjerg samlet/alle løse dokumenter/Ansøgning & CV_Køkkenchef_Svanemøllen_29.06.025.docx","category":"ALL FOLDERS (1)","subCategory":"B","type":"docx","size":20960,"modified":"2025-05-29T18:25:53.000Z"},{"id":"QUxMIEZPTERFUlMgKDEpL0IvMDAuQWx0IGZyYSBiaXNwZWJqZXJnIHNhbWxldC9hbGxlIGzDuHNlIGRva3VtZW50ZXIvQW5zw7hnbmluZyB0aWwgVG9tcyBHZW5lcmF0aW9uc3JhzIpkLmRvY3gvZ29vZ2xlX2RyaXZlX2RhdGE=","name":"Ansøgning til Toms Generationsråd","filename":"Ansøgning til Toms Generationsråd.docx","path":"/google_drive_data/ALL FOLDERS (1)/B/00.Alt fra bispebjerg samlet/alle løse dokumenter/Ansøgning til Toms Generationsråd.docx","category":"ALL FOLDERS (1)","subCategory":"B","type":"docx","size":12107,"modified":"2025-06-26T20:06:13.000Z"},{"id":"QUxMIEZPTERFUlMgKDEpL0IvMDAuQWx0IGZyYSBiaXNwZWJqZXJnIHNhbWxldC9hbGxlIGzDuHNlIGRva3VtZW50ZXIvQXJiZWpkc29wZ2F2ZXNwcsOmc2VudGF0aW9uIEFzaGlzIEdhdXRhbSAoQmFzZXJldCBwYcyKIGRhdGEgZnJhLmRvY3gvZ29vZ2xlX2RyaXZlX2RhdGE=","name":"Arbejdsopgavespræsentation Ashis Gautam (Baseret på data fra","filename":"Arbejdsopgavespræsentation Ashis Gautam (Baseret på data fra.docx","path":"/google_drive_data/ALL FOLDERS (1)/B/00.Alt fra bispebjerg samlet/alle løse dokumenter/Arbejdsopgavespræsentation Ashis Gautam (Baseret på data fra.docx","category":"ALL FOLDERS (1)","subCategory":"B","type":"docx","size":19906,"modified":"2025-03-28T05:38:45.000Z"},{"id":"QUxMIEZPTERFUlMgKDEpL0IvMDAuQWx0IGZyYSBiaXNwZWJqZXJnIHNhbWxldC9hbGxlIGzDuHNlIGRva3VtZW50ZXIvQXNoaXMgQU5Tw5hHTklORyBPRyBDVl9LS19EQVRBXzE4LjAzLjIwMjUg4oCTS29waS5kb2N4L2dvb2dsZV9kcml2ZV9kYXRh","name":"Ashis ANSØGNING OG CV_KK_DATA_18.03.2025 –Kopi","filename":"Ashis ANSØGNING OG CV_KK_DATA_18.03.2025 –Kopi.docx","path":"/google_drive_data/ALL FOLDERS (1)/B/00.Alt fra bispebjerg samlet/alle løse dokumenter/Ashis ANSØGNING OG CV_KK_DATA_18.03.2025 –Kopi.docx","category":"ALL FOLDERS (1)","subCategory":"B","type":"docx","size":37200,"modified":"2025-03-18T21:17:34.000Z"},{"id":"QUxMIEZPTERFUlMgKDEpL0IvMDAuQWx0IGZyYSBiaXNwZWJqZXJnIHNhbWxldC9hbGxlIGzDuHNlIGRva3VtZW50ZXIvQXNoaXMgQ1ZfMTUuMTIuMjAyNC5kb2N4L2dvb2dsZV9kcml2ZV9kYXRh","name":"Ashis CV_15.12.2024","filename":"Ashis CV_15.12.2024.docx","path":"/google_drive_data/ALL FOLDERS (1)/B/00.Alt fra bispebjerg samlet/alle løse dokumenter/Ashis CV_15.12.2024.docx","category":"ALL FOLDERS (1)","subCategory":"B","type":"docx","size":21987,"modified":"2024-12-19T18:47:22.000Z"},{"id":"QUxMIEZPTERFUlMgKDEpL0IvMDAuQWx0IGZyYSBiaXNwZWJqZXJnIHNhbWxldC9hbGxlIGzDuHNlIGRva3VtZW50ZXIvQXNoaXMgQ1ZfMjAyNS5kb2N4L2dvb2dsZV9kcml2ZV9kYXRh","name":"Ashis CV_2025","filename":"Ashis CV_2025.docx","path":"/google_drive_data/ALL FOLDERS (1)/B/00.Alt fra bispebjerg samlet/alle løse dokumenter/Ashis CV_2025.docx","category":"ALL FOLDERS (1)","subCategory":"B","type":"docx","size":26249,"modified":"2025-03-23T09:17:09.000Z"},{"id":"QUxMIEZPTERFUlMgKDEpL0IvMDAuQWx0IGZyYSBiaXNwZWJqZXJnIHNhbWxldC9hbGxlIGzDuHNlIGRva3VtZW50ZXIvQXNoaXMgQ1ZfQ09PUF8wOC4wMy4yMDI1LmRvY3gvZ29vZ2xlX2RyaXZlX2RhdGE=","name":"Ashis CV_COOP_08.03.2025","filename":"Ashis CV_COOP_08.03.2025.docx","path":"/google_drive_data/ALL FOLDERS (1)/B/00.Alt fra bispebjerg samlet/alle løse dokumenter/Ashis CV_COOP_08.03.2025.docx","category":"ALL FOLDERS (1)","subCategory":"B","type":"docx","size":26437,"modified":"2025-03-08T14:29:37.000Z"},{"id":"QUxMIEZPTERFUlMgKDEpL0IvMDAuQWx0IGZyYSBiaXNwZWJqZXJnIHNhbWxldC9hbGxlIGzDuHNlIGRva3VtZW50ZXIvQXNoaXMgQ1ZfQ09PUF8xMy4wMS4yMDI1X3ZfMS4wLmRvY3gvZ29vZ2xlX2RyaXZlX2RhdGE=","name":"Ashis CV_COOP_13.01.2025_v_1.0","filename":"Ashis CV_COOP_13.01.2025_v_1.0.docx","path":"/google_drive_data/ALL FOLDERS (1)/B/00.Alt fra bispebjerg samlet/alle løse dokumenter/Ashis CV_COOP_13.01.2025_v_1.0.docx","category":"ALL FOLDERS (1)","subCategory":"B","type":"docx","size":24119,"modified":"2025-01-13T16:28:33.000Z"},{"id":"QUxMIEZPTERFUlMgKDEpL0IvMDAuQWx0IGZyYSBiaXNwZWJqZXJnIHNhbWxldC9hbGxlIGzDuHNlIGRva3VtZW50ZXIvQXNoaXMgQ1ZfRERNXzI2LjEyLjIwMjQuZG9jeC9nb29nbGVfZHJpdmVfZGF0YQ==","name":"Ashis CV_DDM_26.12.2024","filename":"Ashis CV_DDM_26.12.2024.docx","path":"/google_drive_data/ALL FOLDERS (1)/B/00.Alt fra bispebjerg samlet/alle løse dokumenter/Ashis CV_DDM_26.12.2024.docx","category":"ALL FOLDERS (1)","subCategory":"B","type":"docx","size":24558,"modified":"2025-01-12T12:32:10.000Z"},{"id":"QUxMIEZPTERFUlMgKDEpL0IvMDAuQWx0IGZyYSBiaXNwZWJqZXJnIHNhbWxldC9hbGxlIGzDuHNlIGRva3VtZW50ZXIvQXNoaXMgQ1ZfRlZTVF8yMi4xMi4yMDI0IC0gQ29weS5kb2N4L2dvb2dsZV9kcml2ZV9kYXRh","name":"Ashis CV_FVST_22.12.2024 - Copy","filename":"Ashis CV_FVST_22.12.2024 - Copy.docx","path":"/google_drive_data/ALL FOLDERS (1)/B/00.Alt fra bispebjerg samlet/alle løse dokumenter/Ashis CV_FVST_22.12.2024 - Copy.docx","category":"ALL FOLDERS (1)","subCategory":"B","type":"docx","size":23311,"modified":"2024-12-25T12:14:32.000Z"},{"id":"QUxMIEZPTERFUlMgKDEpL0IvMDAuQWx0IGZyYSBiaXNwZWJqZXJnIHNhbWxldC9hbGxlIGzDuHNlIGRva3VtZW50ZXIvQXNoaXMgQ1ZfRlZTVF9Fcm7DpnJpbmdzZmFnbGlnIGtvbnN1bGVudF8yOS4xMi4yMDI0IC5kb2N4L2dvb2dsZV9kcml2ZV9kYXRh","name":"Ashis CV_FVST_Ernæringsfaglig konsulent_29.12.2024 ","filename":"Ashis CV_FVST_Ernæringsfaglig konsulent_29.12.2024 .docx","path":"/google_drive_data/ALL FOLDERS (1)/B/00.Alt fra bispebjerg samlet/alle løse dokumenter/Ashis CV_FVST_Ernæringsfaglig konsulent_29.12.2024 .docx","category":"ALL FOLDERS (1)","subCategory":"B","type":"docx","size":27531,"modified":"2024-12-29T12:18:10.000Z"},{"id":"QUxMIEZPTERFUlMgKDEpL0IvMDAuQWx0IGZyYSBiaXNwZWJqZXJnIHNhbWxldC9hbGxlIGzDuHNlIGRva3VtZW50ZXIvQXNoaXMgQ1ZfR2VudG9mdGVfMTkuMTIuMjAyNC5kb2N4L2dvb2dsZV9kcml2ZV9kYXRh","name":"Ashis CV_Gentofte_19.12.2024","filename":"Ashis CV_Gentofte_19.12.2024.docx","path":"/google_drive_data/ALL FOLDERS (1)/B/00.Alt fra bispebjerg samlet/alle løse dokumenter/Ashis CV_Gentofte_19.12.2024.docx","category":"ALL FOLDERS (1)","subCategory":"B","type":"docx","size":21755,"modified":"2024-12-19T18:55:24.000Z"},{"id":"QUxMIEZPTERFUlMgKDEpL0IvMDAuQWx0IGZyYSBiaXNwZWJqZXJnIHNhbWxldC9hbGxlIGzDuHNlIGRva3VtZW50ZXIvQXNoaXMgQ1ZfSFJTXzE2LjAyLjIwMjUuZG9jeC9nb29nbGVfZHJpdmVfZGF0YQ==","name":"Ashis CV_HRS_16.02.2025","filename":"Ashis CV_HRS_16.02.2025.docx","path":"/google_drive_data/ALL FOLDERS (1)/B/00.Alt fra bispebjerg samlet/alle løse dokumenter/Ashis CV_HRS_16.02.2025.docx","category":"ALL FOLDERS (1)","subCategory":"B","type":"docx","size":27413,"modified":"2025-02-16T09:33:55.000Z"},{"id":"QUxMIEZPTERFUlMgKDEpL0IvMDAuQWx0IGZyYSBiaXNwZWJqZXJnIHNhbWxldC9hbGxlIGzDuHNlIGRva3VtZW50ZXIvQXNoaXMgQ1ZfTCZGXzA1LjAzLjIwMjUuZG9jeC9nb29nbGVfZHJpdmVfZGF0YQ==","name":"Ashis CV_L&F_05.03.2025","filename":"Ashis CV_L&F_05.03.2025.docx","path":"/google_drive_data/ALL FOLDERS (1)/B/00.Alt fra bispebjerg samlet/alle løse dokumenter/Ashis CV_L&F_05.03.2025.docx","category":"ALL FOLDERS (1)","subCategory":"B","type":"docx","size":29430,"modified":"2025-03-05T18:05:10.000Z"},{"id":"QUxMIEZPTERFUlMgKDEpL0IvMDAuQWx0IGZyYSBiaXNwZWJqZXJnIHNhbWxldC9hbGxlIGzDuHNlIGRva3VtZW50ZXIvQXNoaXMgQ1ZfTm92b25lc2lzX1FGU0NfMjMuMDMuMjAyNS5kb2N4L2dvb2dsZV9kcml2ZV9kYXRh","name":"Ashis CV_Novonesis_QFSC_23.03.2025","filename":"Ashis CV_Novonesis_QFSC_23.03.2025.docx","path":"/google_drive_data/ALL FOLDERS (1)/B/00.Alt fra bispebjerg samlet/alle løse dokumenter/Ashis CV_Novonesis_QFSC_23.03.2025.docx","category":"ALL FOLDERS (1)","subCategory":"B","type":"docx","size":26977,"modified":"2025-03-23T08:26:23.000Z"},{"id":"QUxMIEZPTERFUlMgKDEpL0IvMDAuQWx0IGZyYSBiaXNwZWJqZXJnIHNhbWxldC9hbGxlIGzDuHNlIGRva3VtZW50ZXIvQXNoaXMgQ1ZfT3JrbGFfMDkuMDIuMjAyNS5kb2N4L2dvb2dsZV9kcml2ZV9kYXRh","name":"Ashis CV_Orkla_09.02.2025","filename":"Ashis CV_Orkla_09.02.2025.docx","path":"/google_drive_data/ALL FOLDERS (1)/B/00.Alt fra bispebjerg samlet/alle løse dokumenter/Ashis CV_Orkla_09.02.2025.docx","category":"ALL FOLDERS (1)","subCategory":"B","type":"docx","size":26410,"modified":"2025-02-09T17:49:58.000Z"},{"id":"QUxMIEZPTERFUlMgKDEpL0IvMDAuQWx0IGZyYSBiaXNwZWJqZXJnIHNhbWxldC9hbGxlIGzDuHNlIGRva3VtZW50ZXIvQXNoaXMgQ1ZfT8yIeG5laG9sbV8xMS4wMy4yMDI1LmRvY3gvZ29vZ2xlX2RyaXZlX2RhdGE=","name":"Ashis CV_Öxneholm_11.03.2025","filename":"Ashis CV_Öxneholm_11.03.2025.docx","path":"/google_drive_data/ALL FOLDERS (1)/B/00.Alt fra bispebjerg samlet/alle løse dokumenter/Ashis CV_Öxneholm_11.03.2025.docx","category":"ALL FOLDERS (1)","subCategory":"B","type":"docx","size":26924,"modified":"2025-03-11T18:47:21.000Z"},{"id":"QUxMIEZPTERFUlMgKDEpL0IvMDAuQWx0IGZyYSBiaXNwZWJqZXJnIHNhbWxldC9hbGxlIGzDuHNlIGRva3VtZW50ZXIvQXNoaXMgQ1ZfUkhfMTIuMDEuMjAyNS5kb2N4L2dvb2dsZV9kcml2ZV9kYXRh","name":"Ashis CV_RH_12.01.2025","filename":"Ashis CV_RH_12.01.2025.docx","path":"/google_drive_data/ALL FOLDERS (1)/B/00.Alt fra bispebjerg samlet/alle løse dokumenter/Ashis CV_RH_12.01.2025.docx","category":"ALL FOLDERS (1)","subCategory":"B","type":"docx","size":24558,"modified":"2025-01-12T12:32:39.000Z"},{"id":"QUxMIEZPTERFUlMgKDEpL0IvMDAuQWx0IGZyYSBiaXNwZWJqZXJnIHNhbWxldC9hbGxlIGzDuHNlIGRva3VtZW50ZXIvQXNoaXMgQ1ZfUkhfMTguMDEuMjAyNV92MDQuZG9jeC9nb29nbGVfZHJpdmVfZGF0YQ==","name":"Ashis CV_RH_18.01.2025_v04","filename":"Ashis CV_RH_18.01.2025_v04.docx","path":"/google_drive_data/ALL FOLDERS (1)/B/00.Alt fra bispebjerg samlet/alle løse dokumenter/Ashis CV_RH_18.01.2025_v04.docx","category":"ALL FOLDERS (1)","subCategory":"B","type":"docx","size":26924,"modified":"2025-01-18T10:19:44.000Z"},{"id":"QUxMIEZPTERFUlMgKDEpL0IvMDAuQWx0IGZyYSBiaXNwZWJqZXJnIHNhbWxldC9hbGxlIGzDuHNlIGRva3VtZW50ZXIvQXNoaXMgQ1ZfUm9za2lsZGVfMTYuMDIuMjAyNS5kb2N4L2dvb2dsZV9kcml2ZV9kYXRh","name":"Ashis CV_Roskilde_16.02.2025","filename":"Ashis CV_Roskilde_16.02.2025.docx","path":"/google_drive_data/ALL FOLDERS (1)/B/00.Alt fra bispebjerg samlet/alle løse dokumenter/Ashis CV_Roskilde_16.02.2025.docx","category":"ALL FOLDERS (1)","subCategory":"B","type":"docx","size":27217,"modified":"2025-02-16T12:26:11.000Z"},{"id":"QUxMIEZPTERFUlMgKDEpL0IvMDAuQWx0IGZyYSBiaXNwZWJqZXJnIHNhbWxldC9hbGxlIGzDuHNlIGRva3VtZW50ZXIvQXNoaXMgQ1ZfUsO4bm5lZ2HMinJkXzA5LjAyLjIwMjUuZG9jeC9nb29nbGVfZHJpdmVfZGF0YQ==","name":"Ashis CV_Rønnegård_09.02.2025","filename":"Ashis CV_Rønnegård_09.02.2025.docx","path":"/google_drive_data/ALL FOLDERS (1)/B/00.Alt fra bispebjerg samlet/alle løse dokumenter/Ashis CV_Rønnegård_09.02.2025.docx","category":"ALL FOLDERS (1)","subCategory":"B","type":"docx","size":24708,"modified":"2025-02-09T17:31:29.000Z"},{"id":"QUxMIEZPTERFUlMgKDEpL0IvMDAuQWx0IGZyYSBiaXNwZWJqZXJnIHNhbWxldC9hbGxlIGzDuHNlIGRva3VtZW50ZXIvQXNoaXMgQ1ZfU0ZfVsOmcmttZXN0ZXJfMjkuMDEuMjAyNS5kb2N4L2dvb2dsZV9kcml2ZV9kYXRh","name":"Ashis CV_SF_Værkmester_29.01.2025","filename":"Ashis CV_SF_Værkmester_29.01.2025.docx","path":"/google_drive_data/ALL FOLDERS (1)/B/00.Alt fra bispebjerg samlet/alle løse dokumenter/Ashis CV_SF_Værkmester_29.01.2025.docx","category":"ALL FOLDERS (1)","subCategory":"B","type":"docx","size":28341,"modified":"2025-01-29T20:14:13.000Z"},{"id":"QUxMIEZPTERFUlMgKDEpL0IvMDAuQWx0IGZyYSBiaXNwZWJqZXJnIHNhbWxldC9hbGxlIGzDuHNlIGRva3VtZW50ZXIvQXNoaXMgQ1ZfU2VuaW9yIFByb2R1a3Rpb25zIFNwZWNpYWxpc3RfMTMuMDMuMjAyNS5kb2N4L2dvb2dsZV9kcml2ZV9kYXRh","name":"Ashis CV_Senior Produktions Specialist_13.03.2025","filename":"Ashis CV_Senior Produktions Specialist_13.03.2025.docx","path":"/google_drive_data/ALL FOLDERS (1)/B/00.Alt fra bispebjerg samlet/alle løse dokumenter/Ashis CV_Senior Produktions Specialist_13.03.2025.docx","category":"ALL FOLDERS (1)","subCategory":"B","type":"docx","size":26727,"modified":"2025-03-13T19:34:36.000Z"},{"id":"QUxMIEZPTERFUlMgKDEpL0IvMDAuQWx0IGZyYSBiaXNwZWJqZXJnIHNhbWxldC9hbGxlIGzDuHNlIGRva3VtZW50ZXIvQXNoaXMgR2F1dGFtIC0gQXJiZWpkc29wZ2F2ZXNwcsOmc2VudGF0aW9uXzIwMjUuZG9jeC9nb29nbGVfZHJpdmVfZGF0YQ==","name":"Ashis Gautam - Arbejdsopgavespræsentation_2025","filename":"Ashis Gautam - Arbejdsopgavespræsentation_2025.docx","path":"/google_drive_data/ALL FOLDERS (1)/B/00.Alt fra bispebjerg samlet/alle løse dokumenter/Ashis Gautam - Arbejdsopgavespræsentation_2025.docx","category":"ALL FOLDERS (1)","subCategory":"B","type":"docx","size":19172,"modified":"2025-03-26T20:00:06.000Z"},{"id":"QUxMIEZPTERFUlMgKDEpL0IvMDAuQWx0IGZyYSBiaXNwZWJqZXJnIHNhbWxldC9hbGxlIGzDuHNlIGRva3VtZW50ZXIvQXNoaXNfQW5zw7hnbmluZyBzb20ga8O4a2tlbmxlZGVyIC0gU8O4bmRlcnZhbmcgUGxlamVoamVtLmRvY3gvZ29vZ2xlX2RyaXZlX2RhdGE=","name":"Ashis_Ansøgning som køkkenleder - Søndervang Plejehjem","filename":"Ashis_Ansøgning som køkkenleder - Søndervang Plejehjem.docx","path":"/google_drive_data/ALL FOLDERS (1)/B/00.Alt fra bispebjerg samlet/alle løse dokumenter/Ashis_Ansøgning som køkkenleder - Søndervang Plejehjem.docx","category":"ALL FOLDERS (1)","subCategory":"B","type":"docx","size":21404,"modified":"2025-06-11T18:20:53.000Z"},{"id":"QUxMIEZPTERFUlMgKDEpL0IvMDAuQWx0IGZyYSBiaXNwZWJqZXJnIHNhbWxldC9hbGxlIGzDuHNlIGRva3VtZW50ZXIvQXNoaXNfQW5zw7hnbmluZ19CYWxsZXJ1cF9Lw7hra2VuY2hlZl8xNS4xMi4yMDI0LmRvY3gvZ29vZ2xlX2RyaXZlX2RhdGE=","name":"Ashis_Ansøgning_Ballerup_Køkkenchef_15.12.2024","filename":"Ashis_Ansøgning_Ballerup_Køkkenchef_15.12.2024.docx","path":"/google_drive_data/ALL FOLDERS (1)/B/00.Alt fra bispebjerg samlet/alle løse dokumenter/Ashis_Ansøgning_Ballerup_Køkkenchef_15.12.2024.docx","category":"ALL FOLDERS (1)","subCategory":"B","type":"docx","size":20916,"modified":"2024-12-15T11:06:38.000Z"},{"id":"QUxMIEZPTERFUlMgKDEpL0IvMDAuQWx0IGZyYSBiaXNwZWJqZXJnIHNhbWxldC9hbGxlIGzDuHNlIGRva3VtZW50ZXIvQXNoaXNfQW5zw7hnbmluZ19DT09QXzA4LjAzLjIwMjUuZG9jeC9nb29nbGVfZHJpdmVfZGF0YQ==","name":"Ashis_Ansøgning_COOP_08.03.2025","filename":"Ashis_Ansøgning_COOP_08.03.2025.docx","path":"/google_drive_data/ALL FOLDERS (1)/B/00.Alt fra bispebjerg samlet/alle løse dokumenter/Ashis_Ansøgning_COOP_08.03.2025.docx","category":"ALL FOLDERS (1)","subCategory":"B","type":"docx","size":24442,"modified":"2025-03-08T14:27:37.000Z"},{"id":"QUxMIEZPTERFUlMgKDEpL0IvMDAuQWx0IGZyYSBiaXNwZWJqZXJnIHNhbWxldC9hbGxlIGzDuHNlIGRva3VtZW50ZXIvQXNoaXNfQW5zw7hnbmluZ19DT09QXzEzLjAxLjIwMjVfdl8xLjAuZG9jeC9nb29nbGVfZHJpdmVfZGF0YQ==","name":"Ashis_Ansøgning_COOP_13.01.2025_v_1.0","filename":"Ashis_Ansøgning_COOP_13.01.2025_v_1.0.docx","path":"/google_drive_data/ALL FOLDERS (1)/B/00.Alt fra bispebjerg samlet/alle løse dokumenter/Ashis_Ansøgning_COOP_13.01.2025_v_1.0.docx","category":"ALL FOLDERS (1)","subCategory":"B","type":"docx","size":20804,"modified":"2025-01-13T16:33:46.000Z"},{"id":"QUxMIEZPTERFUlMgKDEpL0IvMDAuQWx0IGZyYSBiaXNwZWJqZXJnIHNhbWxldC9hbGxlIGzDuHNlIGRva3VtZW50ZXIvQXNoaXNfQW5zw7hnbmluZ19DVl9Lw7hra2VubGVkZXJfS0tfMTMuMDQuMjAyNS5kb2N4L2dvb2dsZV9kcml2ZV9kYXRh","name":"Ashis_Ansøgning_CV_Køkkenleder_KK_13.04.2025","filename":"Ashis_Ansøgning_CV_Køkkenleder_KK_13.04.2025.docx","path":"/google_drive_data/ALL FOLDERS (1)/B/00.Alt fra bispebjerg samlet/alle løse dokumenter/Ashis_Ansøgning_CV_Køkkenleder_KK_13.04.2025.docx","category":"ALL FOLDERS (1)","subCategory":"B","type":"docx","size":25954,"modified":"2025-04-13T09:21:57.000Z"},{"id":"QUxMIEZPTERFUlMgKDEpL0IvMDAuQWx0IGZyYSBiaXNwZWJqZXJnIHNhbWxldC9hbGxlIGzDuHNlIGRva3VtZW50ZXIvQXNoaXNfQW5zw7hnbmluZ19ERE1fMjYuMTIuMjAyNC5kb2N4L2dvb2dsZV9kcml2ZV9kYXRh","name":"Ashis_Ansøgning_DDM_26.12.2024","filename":"Ashis_Ansøgning_DDM_26.12.2024.docx","path":"/google_drive_data/ALL FOLDERS (1)/B/00.Alt fra bispebjerg samlet/alle løse dokumenter/Ashis_Ansøgning_DDM_26.12.2024.docx","category":"ALL FOLDERS (1)","subCategory":"B","type":"docx","size":20040,"modified":"2024-12-26T13:44:36.000Z"},{"id":"QUxMIEZPTERFUlMgKDEpL0IvMDAuQWx0IGZyYSBiaXNwZWJqZXJnIHNhbWxldC9hbGxlIGzDuHNlIGRva3VtZW50ZXIvQXNoaXNfQW5zw7hnbmluZ19GVlNUXzIyLjEyLjIwMjQuZG9jeC9nb29nbGVfZHJpdmVfZGF0YQ==","name":"Ashis_Ansøgning_FVST_22.12.2024","filename":"Ashis_Ansøgning_FVST_22.12.2024.docx","path":"/google_drive_data/ALL FOLDERS (1)/B/00.Alt fra bispebjerg samlet/alle løse dokumenter/Ashis_Ansøgning_FVST_22.12.2024.docx","category":"ALL FOLDERS (1)","subCategory":"B","type":"docx","size":23179,"modified":"2024-12-25T12:16:47.000Z"},{"id":"QUxMIEZPTERFUlMgKDEpL0IvMDAuQWx0IGZyYSBiaXNwZWJqZXJnIHNhbWxldC9hbGxlIGzDuHNlIGRva3VtZW50ZXIvQXNoaXNfQW5zw7hnbmluZ19GVlNUXzI5LjEyLjIwMjQuZG9jeC9nb29nbGVfZHJpdmVfZGF0YQ==","name":"Ashis_Ansøgning_FVST_29.12.2024","filename":"Ashis_Ansøgning_FVST_29.12.2024.docx","path":"/google_drive_data/ALL FOLDERS (1)/B/00.Alt fra bispebjerg samlet/alle løse dokumenter/Ashis_Ansøgning_FVST_29.12.2024.docx","category":"ALL FOLDERS (1)","subCategory":"B","type":"docx","size":20801,"modified":"2024-12-29T12:35:40.000Z"},{"id":"QUxMIEZPTERFUlMgKDEpL0IvMDAuQWx0IGZyYSBiaXNwZWJqZXJnIHNhbWxldC9hbGxlIGzDuHNlIGRva3VtZW50ZXIvQXNoaXNfQW5zw7hnbmluZ19HZW50b2Z0ZV8xOS4xMi4yMDI0IC0gQ29weS5kb2N4L2dvb2dsZV9kcml2ZV9kYXRh","name":"Ashis_Ansøgning_Gentofte_19.12.2024 - Copy","filename":"Ashis_Ansøgning_Gentofte_19.12.2024 - Copy.docx","path":"/google_drive_data/ALL FOLDERS (1)/B/00.Alt fra bispebjerg samlet/alle løse dokumenter/Ashis_Ansøgning_Gentofte_19.12.2024 - Copy.docx","category":"ALL FOLDERS (1)","subCategory":"B","type":"docx","size":19744,"modified":"2024-12-19T18:44:34.000Z"},{"id":"QUxMIEZPTERFUlMgKDEpL0IvMDAuQWx0IGZyYSBiaXNwZWJqZXJnIHNhbWxldC9hbGxlIGzDuHNlIGRva3VtZW50ZXIvQXNoaXNfQW5zw7hnbmluZ19IUlNfMTYuMDIuMjAyNS5kb2N4L2dvb2dsZV9kcml2ZV9kYXRh","name":"Ashis_Ansøgning_HRS_16.02.2025","filename":"Ashis_Ansøgning_HRS_16.02.2025.docx","path":"/google_drive_data/ALL FOLDERS (1)/B/00.Alt fra bispebjerg samlet/alle løse dokumenter/Ashis_Ansøgning_HRS_16.02.2025.docx","category":"ALL FOLDERS (1)","subCategory":"B","type":"docx","size":21150,"modified":"2025-02-16T09:16:36.000Z"},{"id":"QUxMIEZPTERFUlMgKDEpL0IvMDAuQWx0IGZyYSBiaXNwZWJqZXJnIHNhbWxldC9hbGxlIGzDuHNlIGRva3VtZW50ZXIvQXNoaXNfQW5zw7hnbmluZ19MJkZfMDUuMDMuMjAyNS5kb2N4L2dvb2dsZV9kcml2ZV9kYXRh","name":"Ashis_Ansøgning_L&F_05.03.2025","filename":"Ashis_Ansøgning_L&F_05.03.2025.docx","path":"/google_drive_data/ALL FOLDERS (1)/B/00.Alt fra bispebjerg samlet/alle løse dokumenter/Ashis_Ansøgning_L&F_05.03.2025.docx","category":"ALL FOLDERS (1)","subCategory":"B","type":"docx","size":23080,"modified":"2025-03-05T17:50:35.000Z"},{"id":"QUxMIEZPTERFUlMgKDEpL0IvMDAuQWx0IGZyYSBiaXNwZWJqZXJnIHNhbWxldC9hbGxlIGzDuHNlIGRva3VtZW50ZXIvQXNoaXNfQW5zw7hnbmluZ19PcmtsYV8wOS4wMi4yMDI1LmRvY3gvZ29vZ2xlX2RyaXZlX2RhdGE=","name":"Ashis_Ansøgning_Orkla_09.02.2025","filename":"Ashis_Ansøgning_Orkla_09.02.2025.docx","path":"/google_drive_data/ALL FOLDERS (1)/B/00.Alt fra bispebjerg samlet/alle løse dokumenter/Ashis_Ansøgning_Orkla_09.02.2025.docx","category":"ALL FOLDERS (1)","subCategory":"B","type":"docx","size":21197,"modified":"2025-02-09T17:48:18.000Z"},{"id":"QUxMIEZPTERFUlMgKDEpL0IvMDAuQWx0IGZyYSBiaXNwZWJqZXJnIHNhbWxldC9hbGxlIGzDuHNlIGRva3VtZW50ZXIvQXNoaXNfQW5zw7hnbmluZ19SSF8wOS4wMi4wMjUuZG9jeC9nb29nbGVfZHJpdmVfZGF0YQ==","name":"Ashis_Ansøgning_RH_09.02.025","filename":"Ashis_Ansøgning_RH_09.02.025.docx","path":"/google_drive_data/ALL FOLDERS (1)/B/00.Alt fra bispebjerg samlet/alle løse dokumenter/Ashis_Ansøgning_RH_09.02.025.docx","category":"ALL FOLDERS (1)","subCategory":"B","type":"docx","size":21491,"modified":"2025-02-09T17:27:22.000Z"},{"id":"QUxMIEZPTERFUlMgKDEpL0IvMDAuQWx0IGZyYSBiaXNwZWJqZXJnIHNhbWxldC9hbGxlIGzDuHNlIGRva3VtZW50ZXIvQXNoaXNfQW5zw7hnbmluZ19SSF8xMi4wMS4yMDI1djIuZG9jeC9nb29nbGVfZHJpdmVfZGF0YQ==","name":"Ashis_Ansøgning_RH_12.01.2025v2","filename":"Ashis_Ansøgning_RH_12.01.2025v2.docx","path":"/google_drive_data/ALL FOLDERS (1)/B/00.Alt fra bispebjerg samlet/alle løse dokumenter/Ashis_Ansøgning_RH_12.01.2025v2.docx","category":"ALL FOLDERS (1)","subCategory":"B","type":"docx","size":22212,"modified":"2025-01-12T17:58:31.000Z"},{"id":"QUxMIEZPTERFUlMgKDEpL0IvMDAuQWx0IGZyYSBiaXNwZWJqZXJnIHNhbWxldC9hbGxlIGzDuHNlIGRva3VtZW50ZXIvQXNoaXNfQW5zw7hnbmluZ19SSF8xMi4wMS4yMDI1djMuMC5kb2N4L2dvb2dsZV9kcml2ZV9kYXRh","name":"Ashis_Ansøgning_RH_12.01.2025v3.0","filename":"Ashis_Ansøgning_RH_12.01.2025v3.0.docx","path":"/google_drive_data/ALL FOLDERS (1)/B/00.Alt fra bispebjerg samlet/alle løse dokumenter/Ashis_Ansøgning_RH_12.01.2025v3.0.docx","category":"ALL FOLDERS (1)","subCategory":"B","type":"docx","size":23549,"modified":"2025-01-18T09:17:36.000Z"},{"id":"QUxMIEZPTERFUlMgKDEpL0IvMDAuQWx0IGZyYSBiaXNwZWJqZXJnIHNhbWxldC9hbGxlIGzDuHNlIGRva3VtZW50ZXIvQXNoaXNfQW5zw7hnbmluZ19SSF8xOC4wMS4yMDI1LmRvY3gvZ29vZ2xlX2RyaXZlX2RhdGE=","name":"Ashis_Ansøgning_RH_18.01.2025","filename":"Ashis_Ansøgning_RH_18.01.2025.docx","path":"/google_drive_data/ALL FOLDERS (1)/B/00.Alt fra bispebjerg samlet/alle løse dokumenter/Ashis_Ansøgning_RH_18.01.2025.docx","category":"ALL FOLDERS (1)","subCategory":"B","type":"docx","size":24813,"modified":"2025-01-18T10:48:57.000Z"},{"id":"QUxMIEZPTERFUlMgKDEpL0IvMDAuQWx0IGZyYSBiaXNwZWJqZXJnIHNhbWxldC9hbGxlIGzDuHNlIGRva3VtZW50ZXIvQXNoaXNfQW5zw7hnbmluZ19Sb3NraWxkZV8xNi4wMi4yMDI1LmRvY3gvZ29vZ2xlX2RyaXZlX2RhdGE=","name":"Ashis_Ansøgning_Roskilde_16.02.2025","filename":"Ashis_Ansøgning_Roskilde_16.02.2025.docx","path":"/google_drive_data/ALL FOLDERS (1)/B/00.Alt fra bispebjerg samlet/alle løse dokumenter/Ashis_Ansøgning_Roskilde_16.02.2025.docx","category":"ALL FOLDERS (1)","subCategory":"B","type":"docx","size":23442,"modified":"2025-02-16T12:19:12.000Z"},{"id":"QUxMIEZPTERFUlMgKDEpL0IvMDAuQWx0IGZyYSBiaXNwZWJqZXJnIHNhbWxldC9hbGxlIGzDuHNlIGRva3VtZW50ZXIvQXNoaXNfQW5zw7hnbmluZ19TRl9Ww6Zya21lc3Rlcl8yOS4wMS4yMDI1IC0gQ29weS5kb2N4L2dvb2dsZV9kcml2ZV9kYXRh","name":"Ashis_Ansøgning_SF_Værkmester_29.01.2025 - Copy","filename":"Ashis_Ansøgning_SF_Værkmester_29.01.2025 - Copy.docx","path":"/google_drive_data/ALL FOLDERS (1)/B/00.Alt fra bispebjerg samlet/alle løse dokumenter/Ashis_Ansøgning_SF_Værkmester_29.01.2025 - Copy.docx","category":"ALL FOLDERS (1)","subCategory":"B","type":"docx","size":24823,"modified":"2025-01-29T20:33:31.000Z"},{"id":"QUxMIEZPTERFUlMgKDEpL0IvMDAuQWx0IGZyYSBiaXNwZWJqZXJnIHNhbWxldC9hbGxlIGzDuHNlIGRva3VtZW50ZXIvQXNoaXNfQXBwbGljYXRpb24gYW5kIENWX0ROVl9Gb29kbGVhZGF1ZGl0b3JfMjAyNS5kb2N4L2dvb2dsZV9kcml2ZV9kYXRh","name":"Ashis_Application and CV_DNV_Foodleadauditor_2025","filename":"Ashis_Application and CV_DNV_Foodleadauditor_2025.docx","path":"/google_drive_data/ALL FOLDERS (1)/B/00.Alt fra bispebjerg samlet/alle løse dokumenter/Ashis_Application and CV_DNV_Foodleadauditor_2025.docx","category":"ALL FOLDERS (1)","subCategory":"B","type":"docx","size":30298,"modified":"2025-03-23T09:40:42.000Z"},{"id":"QUxMIEZPTERFUlMgKDEpL0IvMDAuQWx0IGZyYSBiaXNwZWJqZXJnIHNhbWxldC9hbGxlIGzDuHNlIGRva3VtZW50ZXIvQXVkaW8gZmlsZS5kb2N4L2dvb2dsZV9kcml2ZV9kYXRh","name":"Audio file","filename":"Audio file.docx","path":"/google_drive_data/ALL FOLDERS (1)/B/00.Alt fra bispebjerg samlet/alle løse dokumenter/Audio file.docx","category":"ALL FOLDERS (1)","subCategory":"B","type":"docx","size":11901,"modified":"2024-04-17T17:44:46.000Z"},{"id":"QUxMIEZPTERFUlMgKDEpL0IvMDAuQWx0IGZyYSBiaXNwZWJqZXJnIHNhbWxldC9hbGxlIGzDuHNlIGRva3VtZW50ZXIvQmFzaXMtcXVpeiBGw7hkZXZhcmVoeWdpZWpuZSBvZyBlZ2Vua29udHJvbCBWMy4wLmRvY3gvZ29vZ2xlX2RyaXZlX2RhdGE=","name":"Basis-quiz Fødevarehygiejne og egenkontrol V3.0","filename":"Basis-quiz Fødevarehygiejne og egenkontrol V3.0.docx","path":"/google_drive_data/ALL FOLDERS (1)/B/00.Alt fra bispebjerg samlet/alle løse dokumenter/Basis-quiz Fødevarehygiejne og egenkontrol V3.0.docx","category":"ALL FOLDERS (1)","subCategory":"B","type":"docx","size":11346,"modified":"2025-06-17T14:37:28.000Z"},{"id":"QUxMIEZPTERFUlMgKDEpL0IvMDAuQWx0IGZyYSBiaXNwZWJqZXJnIHNhbWxldC9hbGxlIGzDuHNlIGRva3VtZW50ZXIvQmFzaXMtcXVpeiBGw7hkZXZhcmVoeWdpZWpuZSBvZyBlZ2Vua29udHJvbC5kb2N4L2dvb2dsZV9kcml2ZV9kYXRh","name":"Basis-quiz Fødevarehygiejne og egenkontrol","filename":"Basis-quiz Fødevarehygiejne og egenkontrol.docx","path":"/google_drive_data/ALL FOLDERS (1)/B/00.Alt fra bispebjerg samlet/alle løse dokumenter/Basis-quiz Fødevarehygiejne og egenkontrol.docx","category":"ALL FOLDERS (1)","subCategory":"B","type":"docx","size":11396,"modified":"2025-06-16T10:36:22.000Z"},{"id":"QUxMIEZPTERFUlMgKDEpL0IvMDAuQWx0IGZyYSBiaXNwZWJqZXJnIHNhbWxldC9hbGxlIGzDuHNlIGRva3VtZW50ZXIvQmVhcm5haXNlIGNyZW1lIG1lZCB0YW5nLmRvY3gvZ29vZ2xlX2RyaXZlX2RhdGE=","name":"Bearnaise creme med tang","filename":"Bearnaise creme med tang.docx","path":"/google_drive_data/ALL FOLDERS (1)/B/00.Alt fra bispebjerg samlet/alle løse dokumenter/Bearnaise creme med tang.docx","category":"ALL FOLDERS (1)","subCategory":"B","type":"docx","size":12868,"modified":"2024-11-05T12:51:43.000Z"},{"id":"QUxMIEZPTERFUlMgKDEpL0IvMDAuQWx0IGZyYSBiaXNwZWJqZXJnIHNhbWxldC9hbGxlIGzDuHNlIGRva3VtZW50ZXIvQmVrcsOmZnRlbHNlIGFmIGFuc8OmdHRlbHNlIG9nIHZhbGcgYWYgZnJpdHZhbGdzb3JkbmluZy5kb2N4L2dvb2dsZV9kcml2ZV9kYXRh","name":"Bekræftelse af ansættelse og valg af fritvalgsordning","filename":"Bekræftelse af ansættelse og valg af fritvalgsordning.docx","path":"/google_drive_data/ALL FOLDERS (1)/B/00.Alt fra bispebjerg samlet/alle løse dokumenter/Bekræftelse af ansættelse og valg af fritvalgsordning.docx","category":"ALL FOLDERS (1)","subCategory":"B","type":"docx","size":10314,"modified":"2025-07-27T13:48:00.000Z"},{"id":"QUxMIEZPTERFUlMgKDEpL0IvMDAuQWx0IGZyYSBiaXNwZWJqZXJnIHNhbWxldC9hbGxlIGzDuHNlIGRva3VtZW50ZXIvQmlsYWcgNyBBbmFseXNlIGFmIG1hzIpsdGlkc2Jlc3RpbGxpbmdlci5kb2N4L2dvb2dsZV9kcml2ZV9kYXRh","name":"Bilag 7 Analyse af måltidsbestillinger","filename":"Bilag 7 Analyse af måltidsbestillinger.docx","path":"/google_drive_data/ALL FOLDERS (1)/B/00.Alt fra bispebjerg samlet/alle løse dokumenter/Bilag 7 Analyse af måltidsbestillinger.docx","category":"ALL FOLDERS (1)","subCategory":"B","type":"docx","size":284098,"modified":"2024-12-11T08:44:01.000Z"},{"id":"QUxMIEZPTERFUlMgKDEpL0IvMDAuQWx0IGZyYSBiaXNwZWJqZXJnIHNhbWxldC9hbGxlIGzDuHNlIGRva3VtZW50ZXIvQmlzcGViamVyZyBIb3NwaXRhbC5wZGYvZ29vZ2xlX2RyaXZlX2RhdGE=","name":"Bispebjerg Hospital","filename":"Bispebjerg Hospital.pdf","path":"/google_drive_data/ALL FOLDERS (1)/B/00.Alt fra bispebjerg samlet/alle løse dokumenter/Bispebjerg Hospital.pdf","category":"ALL FOLDERS (1)","subCategory":"B","type":"pdf","size":92416,"modified":"2024-08-20T09:59:13.000Z"},{"id":"QUxMIEZPTERFUlMgKDEpL0IvMDAuQWx0IGZyYSBiaXNwZWJqZXJnIHNhbWxldC9hbGxlIGzDuHNlIGRva3VtZW50ZXIvQmlzcGViamVyZyBob3NwaXRhbCBncsO4bnQga8O4a2tlbiAuZG9jeC9nb29nbGVfZHJpdmVfZGF0YQ==","name":"Bispebjerg hospital grønt køkken ","filename":"Bispebjerg hospital grønt køkken .docx","path":"/google_drive_data/ALL FOLDERS (1)/B/00.Alt fra bispebjerg samlet/alle løse dokumenter/Bispebjerg hospital grønt køkken .docx","category":"ALL FOLDERS (1)","subCategory":"B","type":"docx","size":42228,"modified":"2025-02-04T06:08:46.000Z"},{"id":"QUxMIEZPTERFUlMgKDEpL0IvMDAuQWx0IGZyYSBiaXNwZWJqZXJnIHNhbWxldC9hbGxlIGzDuHNlIGRva3VtZW50ZXIvQm9vayAzLnBkZi9nb29nbGVfZHJpdmVfZGF0YQ==","name":"Book 3","filename":"Book 3.pdf","path":"/google_drive_data/ALL FOLDERS (1)/B/00.Alt fra bispebjerg samlet/alle løse dokumenter/Book 3.pdf","category":"ALL FOLDERS (1)","subCategory":"B","type":"pdf","size":45215,"modified":"2025-09-17T07:01:19.000Z"},{"id":"QUxMIEZPTERFUlMgKDEpL0IvMDAuQWx0IGZyYSBiaXNwZWJqZXJnIHNhbWxldC9hbGxlIGzDuHNlIGRva3VtZW50ZXIvQnJhbW1lciBBZHZva2F0ZXJfMDkuMDYuMjVfRlMuZG9jeC9nb29nbGVfZHJpdmVfZGF0YQ==","name":"Brammer Advokater_09.06.25_FS","filename":"Brammer Advokater_09.06.25_FS.docx","path":"/google_drive_data/ALL FOLDERS (1)/B/00.Alt fra bispebjerg samlet/alle løse dokumenter/Brammer Advokater_09.06.25_FS.docx","category":"ALL FOLDERS (1)","subCategory":"B","type":"docx","size":848822,"modified":"2025-07-18T10:18:32.000Z"},{"id":"QUxMIEZPTERFUlMgKDEpL0IvMDAuQWx0IGZyYSBiaXNwZWJqZXJnIHNhbWxldC9hbGxlIGzDuHNlIGRva3VtZW50ZXIvQnJpZWZpbmcgJiBQcm9kdWt0aW9uc3BsYW4gU21hZyBwYcyKIEFubmViZXJnLmRvY3gvZ29vZ2xlX2RyaXZlX2RhdGE=","name":"Briefing & Produktionsplan Smag på Anneberg","filename":"Briefing & Produktionsplan Smag på Anneberg.docx","path":"/google_drive_data/ALL FOLDERS (1)/B/00.Alt fra bispebjerg samlet/alle løse dokumenter/Briefing & Produktionsplan Smag på Anneberg.docx","category":"ALL FOLDERS (1)","subCategory":"B","type":"docx","size":20328,"modified":"2025-06-10T05:40:37.000Z"},{"id":"QUxMIEZPTERFUlMgKDEpL0IvMDAuQWx0IGZyYSBiaXNwZWJqZXJnIHNhbWxldC9hbGxlIGzDuHNlIGRva3VtZW50ZXIvQnJ1bnN2aWdlci5wZGYvZ29vZ2xlX2RyaXZlX2RhdGE=","name":"Brunsviger","filename":"Brunsviger.pdf","path":"/google_drive_data/ALL FOLDERS (1)/B/00.Alt fra bispebjerg samlet/alle løse dokumenter/Brunsviger.pdf","category":"ALL FOLDERS (1)","subCategory":"B","type":"pdf","size":261325,"modified":"2025-05-23T11:04:11.000Z"},{"id":"QUxMIEZPTERFUlMgKDEpL0IvMDAuQWx0IGZyYSBiaXNwZWJqZXJnIHNhbWxldC9hbGxlIGzDuHNlIGRva3VtZW50ZXIvQ1YgLSBBc2hpcyBHYXV0YW0gLSBLw7hra2VubGVkZXIuZG9jeC9nb29nbGVfZHJpdmVfZGF0YQ==","name":"CV - Ashis Gautam - Køkkenleder","filename":"CV - Ashis Gautam - Køkkenleder.docx","path":"/google_drive_data/ALL FOLDERS (1)/B/00.Alt fra bispebjerg samlet/alle løse dokumenter/CV - Ashis Gautam - Køkkenleder.docx","category":"ALL FOLDERS (1)","subCategory":"B","type":"docx","size":44106,"modified":"2025-06-11T18:10:39.000Z"},{"id":"QUxMIEZPTERFUlMgKDEpL0IvMDAuQWx0IGZyYSBiaXNwZWJqZXJnIHNhbWxldC9hbGxlIGzDuHNlIGRva3VtZW50ZXIvQ2FuZGlkYXRlUmVwb3J0XzIwMjUwNjEyMDczMTIyLnBkZi9nb29nbGVfZHJpdmVfZGF0YQ==","name":"CandidateReport_20250612073122","filename":"CandidateReport_20250612073122.pdf","path":"/google_drive_data/ALL FOLDERS (1)/B/00.Alt fra bispebjerg samlet/alle løse dokumenter/CandidateReport_20250612073122.pdf","category":"ALL FOLDERS (1)","subCategory":"B","type":"pdf","size":1177874,"modified":"2025-06-12T05:31:50.000Z"},{"id":"QUxMIEZPTERFUlMgKDEpL0IvMDAuQWx0IGZyYSBiaXNwZWJqZXJnIHNhbWxldC9hbGxlIGzDuHNlIGRva3VtZW50ZXIvQ2hvY29sYXRlIGNoaXAgY29va2llcyBtZWQgbWlkcmUgc2FsdC5kb2N4L2dvb2dsZV9kcml2ZV9kYXRh","name":"Chocolate chip cookies med midre salt","filename":"Chocolate chip cookies med midre salt.docx","path":"/google_drive_data/ALL FOLDERS (1)/B/00.Alt fra bispebjerg samlet/alle løse dokumenter/Chocolate chip cookies med midre salt.docx","category":"ALL FOLDERS (1)","subCategory":"B","type":"docx","size":14852,"modified":"2025-06-17T07:03:39.000Z"},{"id":"QUxMIEZPTERFUlMgKDEpL0IvMDAuQWx0IGZyYSBiaXNwZWJqZXJnIHNhbWxldC9hbGxlIGzDuHNlIGRva3VtZW50ZXIvQ2hva29sYWRlIGthZ2Ug4oCTQW5hc3Rhc2lhLmRvY3gvZ29vZ2xlX2RyaXZlX2RhdGE=","name":"Chokolade kage –Anastasia","filename":"Chokolade kage –Anastasia.docx","path":"/google_drive_data/ALL FOLDERS (1)/B/00.Alt fra bispebjerg samlet/alle løse dokumenter/Chokolade kage –Anastasia.docx","category":"ALL FOLDERS (1)","subCategory":"B","type":"docx","size":16832,"modified":"2025-07-01T05:42:38.000Z"},{"id":"QUxMIEZPTERFUlMgKDEpL0IvMDAuQWx0IGZyYSBiaXNwZWJqZXJnIHNhbWxldC9hbGxlIGzDuHNlIGRva3VtZW50ZXIvQ2hva29sYWRlIGthZ2UuZG9jeC9nb29nbGVfZHJpdmVfZGF0YQ==","name":"Chokolade kage","filename":"Chokolade kage.docx","path":"/google_drive_data/ALL FOLDERS (1)/B/00.Alt fra bispebjerg samlet/alle løse dokumenter/Chokolade kage.docx","category":"ALL FOLDERS (1)","subCategory":"B","type":"docx","size":14497,"modified":"2025-06-17T07:08:04.000Z"},{"id":"QUxMIEZPTERFUlMgKDEpL0IvMDAuQWx0IGZyYSBiaXNwZWJqZXJnIHNhbWxldC9hbGxlIGzDuHNlIGRva3VtZW50ZXIvQ2hva29sYWRla2FnZSBpbnNwaXJlcmV0IGHigJkgQ1MuZG9jeC9nb29nbGVfZHJpdmVfZGF0YQ==","name":"Chokoladekage inspireret a’ CS","filename":"Chokoladekage inspireret a’ CS.docx","path":"/google_drive_data/ALL FOLDERS (1)/B/00.Alt fra bispebjerg samlet/alle løse dokumenter/Chokoladekage inspireret a’ CS.docx","category":"ALL FOLDERS (1)","subCategory":"B","type":"docx","size":14962,"modified":"2025-05-26T11:15:23.000Z"},{"id":"QUxMIEZPTERFUlMgKDEpL0IvMDAuQWx0IGZyYSBiaXNwZWJqZXJnIHNhbWxldC9hbGxlIGzDuHNlIGRva3VtZW50ZXIvQ29uZmlkZW50aWFsX3RyYW5zbGF0aW9uX1J1c21hLmRvY3gvZ29vZ2xlX2RyaXZlX2RhdGE=","name":"Confidential_translation_Rusma","filename":"Confidential_translation_Rusma.docx","path":"/google_drive_data/ALL FOLDERS (1)/B/00.Alt fra bispebjerg samlet/alle løse dokumenter/Confidential_translation_Rusma.docx","category":"ALL FOLDERS (1)","subCategory":"B","type":"docx","size":102273,"modified":"2024-11-11T06:44:40.000Z"},{"id":"QUxMIEZPTERFUlMgKDEpL0IvMDAuQWx0IGZyYSBiaXNwZWJqZXJnIHNhbWxldC9hbGxlIGzDuHNlIGRva3VtZW50ZXIvQ29wZW5oYWdlbiBjb29raW5nIGRyaW5rIG1lbnUuZG9jeC9nb29nbGVfZHJpdmVfZGF0YQ==","name":"Copenhagen cooking drink menu","filename":"Copenhagen cooking drink menu.docx","path":"/google_drive_data/ALL FOLDERS (1)/B/00.Alt fra bispebjerg samlet/alle løse dokumenter/Copenhagen cooking drink menu.docx","category":"ALL FOLDERS (1)","subCategory":"B","type":"docx","size":15418,"modified":"2024-08-20T18:29:16.000Z"},{"id":"QUxMIEZPTERFUlMgKDEpL0IvMDAuQWx0IGZyYSBiaXNwZWJqZXJnIHNhbWxldC9hbGxlIGzDuHNlIGRva3VtZW50ZXIvREFHRU5TIE1FTlUganVsIDIwMjUuZG9jeC9nb29nbGVfZHJpdmVfZGF0YQ==","name":"DAGENS MENU jul 2025","filename":"DAGENS MENU jul 2025.docx","path":"/google_drive_data/ALL FOLDERS (1)/B/00.Alt fra bispebjerg samlet/alle løse dokumenter/DAGENS MENU jul 2025.docx","category":"ALL FOLDERS (1)","subCategory":"B","type":"docx","size":21445,"modified":"2025-09-12T05:59:57.000Z"},{"id":"QUxMIEZPTERFUlMgKDEpL0IvMDAuQWx0IGZyYSBiaXNwZWJqZXJnIHNhbWxldC9hbGxlIGzDuHNlIGRva3VtZW50ZXIvRGFnbGlnZGFnZW5fIG9wZ2F2ZWxpc3RlLmRvY3gvZ29vZ2xlX2RyaXZlX2RhdGE=","name":"Dagligdagen_ opgaveliste","filename":"Dagligdagen_ opgaveliste.docx","path":"/google_drive_data/ALL FOLDERS (1)/B/00.Alt fra bispebjerg samlet/alle løse dokumenter/Dagligdagen_ opgaveliste.docx","category":"ALL FOLDERS (1)","subCategory":"B","type":"docx","size":21308,"modified":"2023-06-22T05:14:29.000Z"},{"id":"QUxMIEZPTERFUlMgKDEpL0IvMDAuQWx0IGZyYSBiaXNwZWJqZXJnIHNhbWxldC9hbGxlIGzDuHNlIGRva3VtZW50ZXIvRGF0YV9hbmFseXNlX01DU19Lb21wbGV0ZS5kb2N4L2dvb2dsZV9kcml2ZV9kYXRh","name":"Data_analyse_MCS_Komplete","filename":"Data_analyse_MCS_Komplete.docx","path":"/google_drive_data/ALL FOLDERS (1)/B/00.Alt fra bispebjerg samlet/alle løse dokumenter/Data_analyse_MCS_Komplete.docx","category":"ALL FOLDERS (1)","subCategory":"B","type":"docx","size":670305,"modified":"2024-11-11T12:15:14.000Z"},{"id":"QUxMIEZPTERFUlMgKDEpL0IvMDAuQWx0IGZyYSBiaXNwZWJqZXJnIHNhbWxldC9hbGxlIGzDuHNlIGRva3VtZW50ZXIvRGV0YWxqZXJldCBPdmVyc2lndCBvdmVyIEFzaGlzIEdhdXRhbXMgQXJiZWpkc29tcmHMimRlciBvZyBQcm8uZG9jeC9nb29nbGVfZHJpdmVfZGF0YQ==","name":"Detaljeret Oversigt over Ashis Gautams Arbejdsområder og Pro","filename":"Detaljeret Oversigt over Ashis Gautams Arbejdsområder og Pro.docx","path":"/google_drive_data/ALL FOLDERS (1)/B/00.Alt fra bispebjerg samlet/alle løse dokumenter/Detaljeret Oversigt over Ashis Gautams Arbejdsområder og Pro.docx","category":"ALL FOLDERS (1)","subCategory":"B","type":"docx","size":24471,"modified":"2025-03-26T20:24:16.000Z"},{"id":"QUxMIEZPTERFUlMgKDEpL0IvMDAuQWx0IGZyYSBiaXNwZWJqZXJnIHNhbWxldC9hbGxlIGzDuHNlIGRva3VtZW50ZXIvRGV0YWxqZXJldCBPdmVyc2lndCBvdmVyIEFzaGlzIEdhdXRhbXMgQXJiZWpkc29tcmHMimRlciBvZyBQcm8ucGRmL2dvb2dsZV9kcml2ZV9kYXRh","name":"Detaljeret Oversigt over Ashis Gautams Arbejdsområder og Pro","filename":"Detaljeret Oversigt over Ashis Gautams Arbejdsområder og Pro.pdf","path":"/google_drive_data/ALL FOLDERS (1)/B/00.Alt fra bispebjerg samlet/alle løse dokumenter/Detaljeret Oversigt over Ashis Gautams Arbejdsområder og Pro.pdf","category":"ALL FOLDERS (1)","subCategory":"B","type":"pdf","size":143116,"modified":"2025-03-27T19:26:47.000Z"},{"id":"QUxMIEZPTERFUlMgKDEpL0IvMDAuQWx0IGZyYSBiaXNwZWJqZXJnIHNhbWxldC9hbGxlIGzDuHNlIGRva3VtZW50ZXIvRG9jdW1lbnQgMS5kb2N4L2dvb2dsZV9kcml2ZV9kYXRh","name":"Document 1","filename":"Document 1.docx","path":"/google_drive_data/ALL FOLDERS (1)/B/00.Alt fra bispebjerg samlet/alle løse dokumenter/Document 1.docx","category":"ALL FOLDERS (1)","subCategory":"B","type":"docx","size":16106,"modified":"2025-05-29T18:00:33.000Z"},{"id":"QUxMIEZPTERFUlMgKDEpL0IvMDAuQWx0IGZyYSBiaXNwZWJqZXJnIHNhbWxldC9hbGxlIGzDuHNlIGRva3VtZW50ZXIvRG9jdW1lbnQgMi5kb2N4L2dvb2dsZV9kcml2ZV9kYXRh","name":"Document 2","filename":"Document 2.docx","path":"/google_drive_data/ALL FOLDERS (1)/B/00.Alt fra bispebjerg samlet/alle løse dokumenter/Document 2.docx","category":"ALL FOLDERS (1)","subCategory":"B","type":"docx","size":13391,"modified":"2025-08-15T05:53:43.000Z"},{"id":"QUxMIEZPTERFUlMgKDEpL0IvMDAuQWx0IGZyYSBiaXNwZWJqZXJnIHNhbWxldC9hbGxlIGzDuHNlIGRva3VtZW50ZXIvRG9jdW1lbnQgMy5kb2N4L2dvb2dsZV9kcml2ZV9kYXRh","name":"Document 3","filename":"Document 3.docx","path":"/google_drive_data/ALL FOLDERS (1)/B/00.Alt fra bispebjerg samlet/alle løse dokumenter/Document 3.docx","category":"ALL FOLDERS (1)","subCategory":"B","type":"docx","size":9641,"modified":"2025-08-16T07:19:09.000Z"},{"id":"QUxMIEZPTERFUlMgKDEpL0IvMDAuQWx0IGZyYSBiaXNwZWJqZXJnIHNhbWxldC9hbGxlIGzDuHNlIGRva3VtZW50ZXIvRG9jdW1lbnQgNC5kb2N4L2dvb2dsZV9kcml2ZV9kYXRh","name":"Document 4","filename":"Document 4.docx","path":"/google_drive_data/ALL FOLDERS (1)/B/00.Alt fra bispebjerg samlet/alle løse dokumenter/Document 4.docx","category":"ALL FOLDERS (1)","subCategory":"B","type":"docx","size":9648,"modified":"2025-06-19T04:19:16.000Z"},{"id":"QUxMIEZPTERFUlMgKDEpL0IvMDAuQWx0IGZyYSBiaXNwZWJqZXJnIHNhbWxldC9hbGxlIGzDuHNlIGRva3VtZW50ZXIvRG9jdW1lbnQgNS5kb2N4L2dvb2dsZV9kcml2ZV9kYXRh","name":"Document 5","filename":"Document 5.docx","path":"/google_drive_data/ALL FOLDERS (1)/B/00.Alt fra bispebjerg samlet/alle løse dokumenter/Document 5.docx","category":"ALL FOLDERS (1)","subCategory":"B","type":"docx","size":9492,"modified":"2025-09-15T15:38:36.000Z"},{"id":"QUxMIEZPTERFUlMgKDEpL0IvMDAuQWx0IGZyYSBiaXNwZWJqZXJnIHNhbWxldC9hbGxlIGzDuHNlIGRva3VtZW50ZXIvRG9jdW1lbnQgOC5kb2N4L2dvb2dsZV9kcml2ZV9kYXRh","name":"Document 8","filename":"Document 8.docx","path":"/google_drive_data/ALL FOLDERS (1)/B/00.Alt fra bispebjerg samlet/alle løse dokumenter/Document 8.docx","category":"ALL FOLDERS (1)","subCategory":"B","type":"docx","size":9647,"modified":"2025-07-07T18:56:19.000Z"},{"id":"QUxMIEZPTERFUlMgKDEpL0IvMDAuQWx0IGZyYSBiaXNwZWJqZXJnIHNhbWxldC9hbGxlIGzDuHNlIGRva3VtZW50ZXIvRG9jdW1lbnQuZG9jeC9nb29nbGVfZHJpdmVfZGF0YQ==","name":"Document","filename":"Document.docx","path":"/google_drive_data/ALL FOLDERS (1)/B/00.Alt fra bispebjerg samlet/alle løse dokumenter/Document.docx","category":"ALL FOLDERS (1)","subCategory":"B","type":"docx","size":9647,"modified":"2025-05-12T04:55:54.000Z"},{"id":"QUxMIEZPTERFUlMgKDEpL0IvMDAuQWx0IGZyYSBiaXNwZWJqZXJnIHNhbWxldC9hbGxlIGzDuHNlIGRva3VtZW50ZXIvRG9rdW1lbnQuZG9jeC9nb29nbGVfZHJpdmVfZGF0YQ==","name":"Dokument","filename":"Dokument.docx","path":"/google_drive_data/ALL FOLDERS (1)/B/00.Alt fra bispebjerg samlet/alle løse dokumenter/Dokument.docx","category":"ALL FOLDERS (1)","subCategory":"B","type":"docx","size":18280,"modified":"2025-04-14T08:16:12.000Z"},{"id":"QUxMIEZPTERFUlMgKDEpL0IvMDAuQWx0IGZyYSBiaXNwZWJqZXJnIHNhbWxldC9hbGxlIGzDuHNlIGRva3VtZW50ZXIvRW1uZSBBZnNsdXR0ZW5kZSBPcGfDuHJlbHNlIFRBTkdPIFByb2pla3QgLSBCaXNwZWJqZXJnIEhvc3BpdC5kb2N4L2dvb2dsZV9kcml2ZV9kYXRh","name":"Emne Afsluttende Opgørelse TANGO Projekt - Bispebjerg Hospit","filename":"Emne Afsluttende Opgørelse TANGO Projekt - Bispebjerg Hospit.docx","path":"/google_drive_data/ALL FOLDERS (1)/B/00.Alt fra bispebjerg samlet/alle løse dokumenter/Emne Afsluttende Opgørelse TANGO Projekt - Bispebjerg Hospit.docx","category":"ALL FOLDERS (1)","subCategory":"B","type":"docx","size":23388,"modified":"2025-06-27T07:38:01.000Z"},{"id":"QUxMIEZPTERFUlMgKDEpL0IvMDAuQWx0IGZyYSBiaXNwZWJqZXJnIHNhbWxldC9hbGxlIGzDuHNlIGRva3VtZW50ZXIvRW5kZWxpZyB0aWwgS2lyc3RpbmUuZG9jeC9nb29nbGVfZHJpdmVfZGF0YQ==","name":"Endelig til Kirstine","filename":"Endelig til Kirstine.docx","path":"/google_drive_data/ALL FOLDERS (1)/B/00.Alt fra bispebjerg samlet/alle løse dokumenter/Endelig til Kirstine.docx","category":"ALL FOLDERS (1)","subCategory":"B","type":"docx","size":530196,"modified":"2025-03-28T08:27:00.000Z"},{"id":"QUxMIEZPTERFUlMgKDEpL0IvMDAuQWx0IGZyYSBiaXNwZWJqZXJnIHNhbWxldC9hbGxlIGzDuHNlIGRva3VtZW50ZXIvRXJodmVydnMtcGguZC4gaW4gVmV0ZXJpbsOmci0gJiBLdmFsaXRldHNmb3Job2xkX0Fuc8O4Z25pbmdfQXNoaXMuZG9jeC9nb29nbGVfZHJpdmVfZGF0YQ==","name":"Erhvervs-ph.d. in Veterinær- & Kvalitetsforhold_Ansøgning_Ashis","filename":"Erhvervs-ph.d. in Veterinær- & Kvalitetsforhold_Ansøgning_Ashis.docx","path":"/google_drive_data/ALL FOLDERS (1)/B/00.Alt fra bispebjerg samlet/alle løse dokumenter/Erhvervs-ph.d. in Veterinær- & Kvalitetsforhold_Ansøgning_Ashis.docx","category":"ALL FOLDERS (1)","subCategory":"B","type":"docx","size":25396,"modified":"2025-03-16T19:23:05.000Z"},{"id":"QUxMIEZPTERFUlMgKDEpL0IvMDAuQWx0IGZyYSBiaXNwZWJqZXJnIHNhbWxldC9hbGxlIGzDuHNlIGRva3VtZW50ZXIvRnJpa2FkZWxsZW1hc2tpbmVuIGVyIHVkbGHMim50IHRpbCBFQVQgZnJhIGRlbiAxNS5kb2N4L2dvb2dsZV9kcml2ZV9kYXRh","name":"Frikadellemaskinen er udlånt til EAT fra den 15","filename":"Frikadellemaskinen er udlånt til EAT fra den 15.docx","path":"/google_drive_data/ALL FOLDERS (1)/B/00.Alt fra bispebjerg samlet/alle løse dokumenter/Frikadellemaskinen er udlånt til EAT fra den 15.docx","category":"ALL FOLDERS (1)","subCategory":"B","type":"docx","size":12496,"modified":"2023-11-15T05:17:19.000Z"},{"id":"QUxMIEZPTERFUlMgKDEpL0IvMDAuQWx0IGZyYSBiaXNwZWJqZXJnIHNhbWxldC9hbGxlIGzDuHNlIGRva3VtZW50ZXIvR2VuZXJpc2sgc3RpbGxpbmdzYmVza3JpdmVsc2VfZHJpZnRzbGVkZXIgbWVkIGt1bGluYXJpc2sgYW5zdmFyXzEwLjAyLmRvYy9nb29nbGVfZHJpdmVfZGF0YQ==","name":"Generisk stillingsbeskrivelse_driftsleder med kulinarisk ansvar_10.02","filename":"Generisk stillingsbeskrivelse_driftsleder med kulinarisk ansvar_10.02.doc","path":"/google_drive_data/ALL FOLDERS (1)/B/00.Alt fra bispebjerg samlet/alle løse dokumenter/Generisk stillingsbeskrivelse_driftsleder med kulinarisk ansvar_10.02.doc","category":"ALL FOLDERS (1)","subCategory":"B","type":"doc","size":117760,"modified":"2025-02-10T08:54:31.000Z"},{"id":"QUxMIEZPTERFUlMgKDEpL0IvMDAuQWx0IGZyYSBiaXNwZWJqZXJnIHNhbWxldC9hbGxlIGzDuHNlIGRva3VtZW50ZXIvR2V0UGRmRG9rdW1lbnQucGRmL2dvb2dsZV9kcml2ZV9kYXRh","name":"GetPdfDokument","filename":"GetPdfDokument.pdf","path":"/google_drive_data/ALL FOLDERS (1)/B/00.Alt fra bispebjerg samlet/alle løse dokumenter/GetPdfDokument.pdf","category":"ALL FOLDERS (1)","subCategory":"B","type":"pdf","size":221430,"modified":"2025-03-21T10:28:09.000Z"},{"id":"QUxMIEZPTERFUlMgKDEpL0IvMDAuQWx0IGZyYSBiaXNwZWJqZXJnIHNhbWxldC9hbGxlIGzDuHNlIGRva3VtZW50ZXIvR2zDuGdnIHRpbCAxNSBrZy5kb2N4L2dvb2dsZV9kcml2ZV9kYXRh","name":"Gløgg til 15 kg","filename":"Gløgg til 15 kg.docx","path":"/google_drive_data/ALL FOLDERS (1)/B/00.Alt fra bispebjerg samlet/alle løse dokumenter/Gløgg til 15 kg.docx","category":"ALL FOLDERS (1)","subCategory":"B","type":"docx","size":13916,"modified":"2024-12-03T09:13:43.000Z"},{"id":"QUxMIEZPTERFUlMgKDEpL0IvMDAuQWx0IGZyYSBiaXNwZWJqZXJnIHNhbWxldC9hbGxlIGzDuHNlIGRva3VtZW50ZXIvR3JlZW4gYnkgRGVmYXVsdF9sw6ZnZ2VzIGkgYmzDuGQuZG9jeC9nb29nbGVfZHJpdmVfZGF0YQ==","name":"Green by Default_lægges i blød","filename":"Green by Default_lægges i blød.docx","path":"/google_drive_data/ALL FOLDERS (1)/B/00.Alt fra bispebjerg samlet/alle løse dokumenter/Green by Default_lægges i blød.docx","category":"ALL FOLDERS (1)","subCategory":"B","type":"docx","size":14532,"modified":"2024-06-14T04:09:11.000Z"},{"id":"QUxMIEZPTERFUlMgKDEpL0IvMDAuQWx0IGZyYSBiaXNwZWJqZXJnIHNhbWxldC9hbGxlIGzDuHNlIGRva3VtZW50ZXIvR3JlZW4gYnkgZGVmYXVsdCBhZnJhcHBvcnRlcmluZ18gQXNoaXMuZG9jeC9nb29nbGVfZHJpdmVfZGF0YQ==","name":"Green by default afrapportering_ Ashis","filename":"Green by default afrapportering_ Ashis.docx","path":"/google_drive_data/ALL FOLDERS (1)/B/00.Alt fra bispebjerg samlet/alle løse dokumenter/Green by default afrapportering_ Ashis.docx","category":"ALL FOLDERS (1)","subCategory":"B","type":"docx","size":17308,"modified":"2024-10-30T05:55:40.000Z"},{"id":"QUxMIEZPTERFUlMgKDEpL0IvMDAuQWx0IGZyYSBiaXNwZWJqZXJnIHNhbWxldC9hbGxlIGzDuHNlIGRva3VtZW50ZXIvR3LDuG4gQm9sb2duZXNlIG1lZCBUYW5nIG9nIFRvZnUuZG9jeC9nb29nbGVfZHJpdmVfZGF0YQ==","name":"Grøn Bolognese med Tang og Tofu","filename":"Grøn Bolognese med Tang og Tofu.docx","path":"/google_drive_data/ALL FOLDERS (1)/B/00.Alt fra bispebjerg samlet/alle løse dokumenter/Grøn Bolognese med Tang og Tofu.docx","category":"ALL FOLDERS (1)","subCategory":"B","type":"docx","size":24555,"modified":"2025-03-18T20:14:00.000Z"},{"id":"QUxMIEZPTERFUlMgKDEpL0IvMDAuQWx0IGZyYSBiaXNwZWJqZXJnIHNhbWxldC9hbGxlIGzDuHNlIGRva3VtZW50ZXIvSGVydW5kZXIgZmluZGVyIGR1IGVuIGRldGFsamVyZXQgb2cgYXZhbmNlcmV0IHJpc2lrb2FuYWx5c2UuZG9jeC9nb29nbGVfZHJpdmVfZGF0YQ==","name":"Herunder finder du en detaljeret og avanceret risikoanalyse","filename":"Herunder finder du en detaljeret og avanceret risikoanalyse.docx","path":"/google_drive_data/ALL FOLDERS (1)/B/00.Alt fra bispebjerg samlet/alle løse dokumenter/Herunder finder du en detaljeret og avanceret risikoanalyse.docx","category":"ALL FOLDERS (1)","subCategory":"B","type":"docx","size":22860,"modified":"2025-07-18T05:00:11.000Z"},{"id":"QUxMIEZPTERFUlMgKDEpL0IvMDAuQWx0IGZyYSBiaXNwZWJqZXJnIHNhbWxldC9hbGxlIGzDuHNlIGRva3VtZW50ZXIvSGplbW1lb3BnYXZlIDEgUHJvamVrdHZhbGcgb2cgU3R5cmluZ3N2w6Zya3TDuGplci5kb2N4L2dvb2dsZV9kcml2ZV9kYXRh","name":"Hjemmeopgave 1 Projektvalg og Styringsværktøjer","filename":"Hjemmeopgave 1 Projektvalg og Styringsværktøjer.docx","path":"/google_drive_data/ALL FOLDERS (1)/B/00.Alt fra bispebjerg samlet/alle løse dokumenter/Hjemmeopgave 1 Projektvalg og Styringsværktøjer.docx","category":"ALL FOLDERS (1)","subCategory":"B","type":"docx","size":19171,"modified":"2025-09-10T19:18:55.000Z"},{"id":"QUxMIEZPTERFUlMgKDEpL0IvMDAuQWx0IGZyYSBiaXNwZWJqZXJnIHNhbWxldC9hbGxlIGzDuHNlIGRva3VtZW50ZXIvSGplbW1lb3BnYXZlIDEgUHJvamVrdHZhbGcgb2cgU3R5cmluZ3N2w6Zya3TDuGplcjEuZG9jeC9nb29nbGVfZHJpdmVfZGF0YQ==","name":"Hjemmeopgave 1 Projektvalg og Styringsværktøjer1","filename":"Hjemmeopgave 1 Projektvalg og Styringsværktøjer1.docx","path":"/google_drive_data/ALL FOLDERS (1)/B/00.Alt fra bispebjerg samlet/alle løse dokumenter/Hjemmeopgave 1 Projektvalg og Styringsværktøjer1.docx","category":"ALL FOLDERS (1)","subCategory":"B","type":"docx","size":27139,"modified":"2025-09-22T08:47:32.000Z"},{"id":"QUxMIEZPTERFUlMgKDEpL0IvMDAuQWx0IGZyYSBiaXNwZWJqZXJnIHNhbWxldC9hbGxlIGzDuHNlIGRva3VtZW50ZXIvSG9ubmluZyBJc29tYWx0IFR1aWxlcyBIdXJ0aWcgT3Bza3JpZnQgJiBTaWtrZXJoZWQuZG9jeC9nb29nbGVfZHJpdmVfZGF0YQ==","name":"Honning Isomalt Tuiles Hurtig Opskrift & Sikkerhed","filename":"Honning Isomalt Tuiles Hurtig Opskrift & Sikkerhed.docx","path":"/google_drive_data/ALL FOLDERS (1)/B/00.Alt fra bispebjerg samlet/alle løse dokumenter/Honning Isomalt Tuiles Hurtig Opskrift & Sikkerhed.docx","category":"ALL FOLDERS (1)","subCategory":"B","type":"docx","size":12650,"modified":"2025-07-21T07:38:06.000Z"},{"id":"QUxMIEZPTERFUlMgKDEpL0IvMDAuQWx0IGZyYSBiaXNwZWJqZXJnIHNhbWxldC9hbGxlIGzDuHNlIGRva3VtZW50ZXIvSHZlbSByaW5nZXMgZGVyIHRpbCBKdWwgb2cgbnl0YcyKci5kb2N4L2dvb2dsZV9kcml2ZV9kYXRh","name":"Hvem ringes der til Jul og nytår","filename":"Hvem ringes der til Jul og nytår.docx","path":"/google_drive_data/ALL FOLDERS (1)/B/00.Alt fra bispebjerg samlet/alle løse dokumenter/Hvem ringes der til Jul og nytår.docx","category":"ALL FOLDERS (1)","subCategory":"B","type":"docx","size":13701,"modified":"2023-11-23T11:40:50.000Z"},{"id":"QUxMIEZPTERFUlMgKDEpL0IvMDAuQWx0IGZyYSBiaXNwZWJqZXJnIHNhbWxldC9hbGxlIGzDuHNlIGRva3VtZW50ZXIvSU50ZXJ2aWV3IEFOWUEuZG9jeC9nb29nbGVfZHJpdmVfZGF0YQ==","name":"INterview ANYA","filename":"INterview ANYA.docx","path":"/google_drive_data/ALL FOLDERS (1)/B/00.Alt fra bispebjerg samlet/alle løse dokumenter/INterview ANYA.docx","category":"ALL FOLDERS (1)","subCategory":"B","type":"docx","size":32187,"modified":"2024-06-12T04:13:38.000Z"},{"id":"QUxMIEZPTERFUlMgKDEpL0IvMDAuQWx0IGZyYSBiaXNwZWJqZXJnIHNhbWxldC9hbGxlIGzDuHNlIGRva3VtZW50ZXIvSW5kaG9sZHNmb3J0ZWduZWxzZS5kb2N4L2dvb2dsZV9kcml2ZV9kYXRh","name":"Indholdsfortegnelse","filename":"Indholdsfortegnelse.docx","path":"/google_drive_data/ALL FOLDERS (1)/B/00.Alt fra bispebjerg samlet/alle løse dokumenter/Indholdsfortegnelse.docx","category":"ALL FOLDERS (1)","subCategory":"B","type":"docx","size":21048,"modified":"2025-04-05T09:30:19.000Z"},{"id":"QUxMIEZPTERFUlMgKDEpL0IvMDAuQWx0IGZyYSBiaXNwZWJqZXJnIHNhbWxldC9hbGxlIGzDuHNlIGRva3VtZW50ZXIvSmVnIGVyIGdhzIpldCBmb3IgaSBkYWcuZG9jeC9nb29nbGVfZHJpdmVfZGF0YQ==","name":"Jeg er gået for i dag","filename":"Jeg er gået for i dag.docx","path":"/google_drive_data/ALL FOLDERS (1)/B/00.Alt fra bispebjerg samlet/alle løse dokumenter/Jeg er gået for i dag.docx","category":"ALL FOLDERS (1)","subCategory":"B","type":"docx","size":13940,"modified":"2023-12-01T10:31:52.000Z"},{"id":"QUxMIEZPTERFUlMgKDEpL0IvMDAuQWx0IGZyYSBiaXNwZWJqZXJnIHNhbWxldC9hbGxlIGzDuHNlIGRva3VtZW50ZXIvS2FnZWNyZW1lIHRpbCBsYWdrYWdlLmRvY3gvZ29vZ2xlX2RyaXZlX2RhdGE=